"No.","Time","Source","Destination","Protocol","Length","Info"
"1","0.000000000","10.0.2.15","34.207.24.140","TCP","54","40602  >  443 [ACK] Seq=1 Ack=1 Win=63360 Len=0"
"2","0.000163841","34.207.24.140","10.0.2.15","TCP","60","[TCP ACKed unseen segment] 443  >  40602 [ACK] Seq=1 Ack=2 Win=65535 Len=0"
"16","0.361527806","10.0.2.15","23.203.176.221","OCSP","478","Request"
"17","0.361721281","23.203.176.221","10.0.2.15","TCP","60","80  >  46946 [ACK] Seq=1 Ack=425 Win=65535 Len=0"
"19","0.371220562","23.203.176.221","10.0.2.15","OCSP","928","Response"
"20","0.371226217","10.0.2.15","23.203.176.221","TCP","54","46946  >  80 [ACK] Seq=425 Ack=875 Win=63729 Len=0"
"86","0.488683984","10.0.2.15","142.251.35.170","TCP","74","48252  >  443 [SYN] Seq=0 Win=64240 Len=0 MSS=1460 SACK_PERM=1 TSval=2295324457 TSecr=0 WS=128"
"106","0.495675755","142.251.35.170","10.0.2.15","TCP","60","443  >  48252 [SYN, ACK] Seq=0 Ack=1 Win=65535 Len=0 MSS=1460"
"109","0.495692609","10.0.2.15","142.251.35.170","TCP","54","48252  >  443 [ACK] Seq=1 Ack=1 Win=64240 Len=0"
"120","0.497230991","10.0.2.15","142.251.35.170","TLSv1.3","726","Client Hello"
"121","0.497333485","142.251.35.170","10.0.2.15","TCP","60","443  >  48252 [ACK] Seq=1 Ack=673 Win=65535 Len=0"
"122","0.497397209","10.0.2.15","142.251.35.170","TLSv1.3","60","Change Cipher Spec"
"123","0.497412894","10.0.2.15","142.251.35.170","TLSv1.3","677","Application Data"
"124","0.497484653","142.251.35.170","10.0.2.15","TCP","60","443  >  48252 [ACK] Seq=1 Ack=679 Win=65535 Len=0"
"125","0.497527244","142.251.35.170","10.0.2.15","TCP","60","443  >  48252 [ACK] Seq=1 Ack=1302 Win=65535 Len=0"
"126","0.497651486","10.0.2.15","23.203.176.221","OCSP","478","Request"
"127","0.497708348","23.203.176.221","10.0.2.15","TCP","60","80  >  46956 [ACK] Seq=1 Ack=425 Win=65535 Len=0"
"129","0.498721739","10.0.2.15","23.203.176.221","OCSP","478","Request"
"130","0.498809363","23.203.176.221","10.0.2.15","TCP","60","80  >  46946 [ACK] Seq=875 Ack=849 Win=65535 Len=0"
"135","0.509209944","23.203.176.221","10.0.2.15","OCSP","927","Response"
"136","0.509215391","10.0.2.15","23.203.176.221","TCP","54","46956  >  80 [ACK] Seq=425 Ack=874 Win=63729 Len=0"
"139","0.511968620","23.203.176.221","10.0.2.15","OCSP","928","Response"
"140","0.511973957","10.0.2.15","23.203.176.221","TCP","54","46946  >  80 [ACK] Seq=849 Ack=1749 Win=63729 Len=0"
"141","0.512368456","10.0.2.15","192.124.249.24","TCP","54","55184  >  80 [ACK] Seq=1 Ack=1 Win=63360 Len=0"
"142","0.512483106","192.124.249.24","10.0.2.15","TCP","60","[TCP ACKed unseen segment] 80  >  55184 [ACK] Seq=1 Ack=2 Win=65535 Len=0"
"147","0.517917584","142.251.35.170","10.0.2.15","TLSv1.3","884","Server Hello, Change Cipher Spec, Application Data, Application Data, Application Data"
"148","0.517922572","10.0.2.15","142.251.35.170","TCP","54","48252  >  443 [ACK] Seq=1302 Ack=831 Win=63910 Len=0"
"149","0.518243945","10.0.2.15","142.251.35.170","TLSv1.3","138","Application Data, Application Data"
"150","0.518253846","142.251.35.170","10.0.2.15","TLSv1.3","85","Application Data"
"151","0.518260682","10.0.2.15","142.251.35.170","TCP","54","48252  >  443 [ACK] Seq=1386 Ack=862 Win=63910 Len=0"
"152","0.518363309","142.251.35.170","10.0.2.15","TCP","60","443  >  48252 [ACK] Seq=862 Ack=1386 Win=65535 Len=0"
"154","0.518730033","10.0.2.15","142.251.35.170","TLSv1.3","85","Application Data"
"155","0.518853435","142.251.35.170","10.0.2.15","TCP","60","443  >  48252 [ACK] Seq=862 Ack=1417 Win=65535 Len=0"
"157","0.528350552","142.251.35.170","10.0.2.15","TLSv1.3","274","Application Data"
"158","0.528355726","10.0.2.15","142.251.35.170","TCP","54","48252  >  443 [ACK] Seq=1417 Ack=1082 Win=63910 Len=0"
"159","0.528525698","142.251.35.170","10.0.2.15","TLSv1.3","376","Application Data, Application Data"
"160","0.528530828","10.0.2.15","142.251.35.170","TCP","54","48252  >  443 [ACK] Seq=1417 Ack=1404 Win=63910 Len=0"
"161","0.528624619","10.0.2.15","142.251.35.170","TLSv1.3","93","Application Data"
"162","0.528632974","142.251.35.170","10.0.2.15","TLSv1.3","93","Application Data"
"163","0.528638072","10.0.2.15","142.251.35.170","TCP","54","48252  >  443 [ACK] Seq=1456 Ack=1443 Win=63910 Len=0"
"164","0.528709504","142.251.35.170","10.0.2.15","TCP","60","443  >  48252 [ACK] Seq=1443 Ack=1456 Win=65535 Len=0"
"165","0.528744185","10.0.2.15","142.251.35.170","TLSv1.3","78","Application Data"
"166","0.528756708","10.0.2.15","142.251.35.170","TCP","54","48252  >  443 [FIN, ACK] Seq=1480 Ack=1443 Win=63910 Len=0"
"167","0.528891888","142.251.35.170","10.0.2.15","TCP","60","443  >  48252 [ACK] Seq=1443 Ack=1480 Win=65535 Len=0"
"168","0.528891964","142.251.35.170","10.0.2.15","TCP","60","443  >  48252 [ACK] Seq=1443 Ack=1481 Win=65535 Len=0"
"169","0.535932555","142.251.35.170","10.0.2.15","TCP","60","443  >  48252 [FIN, ACK] Seq=1443 Ack=1481 Win=65535 Len=0"
"170","0.535939402","10.0.2.15","142.251.35.170","TCP","54","48252  >  443 [ACK] Seq=1481 Ack=1444 Win=63910 Len=0"
"278","0.702643272","10.0.2.15","209.54.183.75","TCP","74","56264  >  443 [SYN] Seq=0 Win=64240 Len=0 MSS=1460 SACK_PERM=1 TSval=1703145226 TSecr=0 WS=128"
"297","0.717937910","209.54.183.75","10.0.2.15","TCP","60","443  >  56264 [SYN, ACK] Seq=0 Ack=1 Win=65535 Len=0 MSS=1460"
"298","0.717964532","10.0.2.15","209.54.183.75","TCP","54","56264  >  443 [ACK] Seq=1 Ack=1 Win=64240 Len=0"
"299","0.718956568","10.0.2.15","209.54.183.75","TLSv1.3","571","Client Hello"
"300","0.719059799","209.54.183.75","10.0.2.15","TCP","60","443  >  56264 [ACK] Seq=1 Ack=518 Win=65535 Len=0"
"308","0.738352163","209.54.183.75","10.0.2.15","TLSv1.3","1514","Server Hello, Change Cipher Spec, Application Data"
"309","0.738358354","10.0.2.15","209.54.183.75","TCP","54","56264  >  443 [ACK] Seq=518 Ack=1461 Win=63360 Len=0"
"310","0.738443820","209.54.183.75","10.0.2.15","TCP","1514","443  >  56264 [PSH, ACK] Seq=1461 Ack=518 Win=65535 Len=1460 [TCP segment of a reassembled PDU]"
"311","0.738446828","10.0.2.15","209.54.183.75","TCP","54","56264  >  443 [ACK] Seq=518 Ack=2921 Win=61920 Len=0"
"312","0.738536592","209.54.183.75","10.0.2.15","TCP","1230","443  >  56264 [PSH, ACK] Seq=2921 Ack=518 Win=65535 Len=1176 [TCP segment of a reassembled PDU]"
"313","0.738538036","10.0.2.15","209.54.183.75","TCP","54","56264  >  443 [ACK] Seq=518 Ack=4097 Win=60744 Len=0"
"314","0.739484038","209.54.183.75","10.0.2.15","TCP","1494","443  >  56264 [ACK] Seq=4097 Ack=518 Win=65535 Len=1440 [TCP segment of a reassembled PDU]"
"315","0.739489080","10.0.2.15","209.54.183.75","TCP","54","56264  >  443 [ACK] Seq=518 Ack=5537 Win=63360 Len=0"
"316","0.739529582","209.54.183.75","10.0.2.15","TCP","74","443  >  56264 [PSH, ACK] Seq=5537 Ack=518 Win=65535 Len=20 [TCP segment of a reassembled PDU]"
"317","0.739530993","10.0.2.15","209.54.183.75","TCP","54","56264  >  443 [ACK] Seq=518 Ack=5557 Win=63360 Len=0"
"318","0.739572644","209.54.183.75","10.0.2.15","TLSv1.3","640","Application Data, Application Data, Application Data"
"319","0.739573628","10.0.2.15","209.54.183.75","TCP","54","56264  >  443 [ACK] Seq=518 Ack=6143 Win=63360 Len=0"
"323","0.743453853","10.0.2.15","209.54.183.75","TLSv1.3","118","Change Cipher Spec, Application Data"
"324","0.743547150","209.54.183.75","10.0.2.15","TCP","60","443  >  56264 [ACK] Seq=6143 Ack=582 Win=65535 Len=0"
"325","0.743652086","10.0.2.15","209.54.183.75","TLSv1.3","1281","Application Data"
"326","0.743729103","209.54.183.75","10.0.2.15","TCP","60","443  >  56264 [ACK] Seq=6143 Ack=1809 Win=65535 Len=0"
"328","0.751871270","10.0.2.15","108.139.47.9","TLSv1.2","93","Application Data"
"329","0.751950223","108.139.47.9","10.0.2.15","TCP","60","443  >  55836 [ACK] Seq=1 Ack=40 Win=65535 Len=0"
"330","0.751979990","10.0.2.15","104.18.24.18","TLSv1.2","93","Application Data"
"331","0.752056012","104.18.24.18","10.0.2.15","TCP","60","443  >  35660 [ACK] Seq=1 Ack=40 Win=65535 Len=0"
"332","0.752200415","10.0.2.15","104.18.24.18","TLSv1.2","78","Application Data"
"333","0.752209712","10.0.2.15","104.18.24.18","TCP","54","35660  >  443 [FIN, ACK] Seq=64 Ack=1 Win=63360 Len=0"
"334","0.752333142","10.0.2.15","108.139.47.9","TLSv1.2","78","Application Data"
"335","0.752335718","104.18.24.18","10.0.2.15","TCP","60","443  >  35660 [ACK] Seq=1 Ack=64 Win=65535 Len=0"
"336","0.752335806","104.18.24.18","10.0.2.15","TCP","60","443  >  35660 [ACK] Seq=1 Ack=65 Win=65535 Len=0"
"337","0.752339038","10.0.2.15","108.139.47.9","TCP","54","55836  >  443 [FIN, ACK] Seq=64 Ack=1 Win=63360 Len=0"
"338","0.752505896","108.139.47.9","10.0.2.15","TCP","60","443  >  55836 [ACK] Seq=1 Ack=64 Win=65535 Len=0"
"339","0.752694938","108.139.47.9","10.0.2.15","TCP","60","443  >  55836 [ACK] Seq=1 Ack=65 Win=65535 Len=0"
"341","0.758011554","209.54.183.75","10.0.2.15","TLSv1.3","212","Application Data, Application Data"
"342","0.758022962","10.0.2.15","209.54.183.75","TCP","54","56264  >  443 [ACK] Seq=1809 Ack=6301 Win=63360 Len=0"
"343","0.759978697","108.139.47.9","10.0.2.15","TCP","60","443  >  55836 [FIN, ACK] Seq=1 Ack=65 Win=65535 Len=0"
"344","0.759985697","10.0.2.15","108.139.47.9","TCP","54","55836  >  443 [ACK] Seq=65 Ack=2 Win=63360 Len=0"
"345","0.761362282","104.18.24.18","10.0.2.15","TCP","60","443  >  35660 [FIN, ACK] Seq=1 Ack=65 Win=65535 Len=0"
"346","0.761368440","10.0.2.15","104.18.24.18","TCP","54","35660  >  443 [ACK] Seq=65 Ack=2 Win=63360 Len=0"
"424","0.780289939","209.54.183.75","10.0.2.15","TLSv1.3","520","Application Data, Application Data"
"425","0.780294861","10.0.2.15","209.54.183.75","TCP","54","56264  >  443 [ACK] Seq=1809 Ack=6767 Win=63360 Len=0"
"434","0.805251896","10.0.2.15","44.215.128.78","TCP","74","45226  >  443 [SYN] Seq=0 Win=64240 Len=0 MSS=1460 SACK_PERM=1 TSval=1703608772 TSecr=0 WS=128"
"437","0.821032755","44.215.128.78","10.0.2.15","TCP","60","443  >  45226 [SYN, ACK] Seq=0 Ack=1 Win=65535 Len=0 MSS=1460"
"438","0.821045726","10.0.2.15","44.215.128.78","TCP","54","45226  >  443 [ACK] Seq=1 Ack=1 Win=64240 Len=0"
"439","0.822072855","10.0.2.15","44.215.128.78","TLSv1.3","571","Client Hello"
"440","0.822163483","44.215.128.78","10.0.2.15","TCP","60","443  >  45226 [ACK] Seq=1 Ack=518 Win=65535 Len=0"
"445","0.839290754","44.215.128.78","10.0.2.15","TLSv1.3","1434","Server Hello, Change Cipher Spec, Application Data"
"446","0.839296037","10.0.2.15","44.215.128.78","TCP","54","45226  >  443 [ACK] Seq=518 Ack=1381 Win=63480 Len=0"
"447","0.839366956","44.215.128.78","10.0.2.15","TCP","1434","443  >  45226 [PSH, ACK] Seq=1381 Ack=518 Win=65535 Len=1380 [TCP segment of a reassembled PDU]"
"448","0.839370019","10.0.2.15","44.215.128.78","TCP","54","45226  >  443 [ACK] Seq=518 Ack=2761 Win=63480 Len=0"
"449","0.839445390","44.215.128.78","10.0.2.15","TCP","1390","443  >  45226 [PSH, ACK] Seq=2761 Ack=518 Win=65535 Len=1336 [TCP segment of a reassembled PDU]"
"450","0.839446812","10.0.2.15","44.215.128.78","TCP","54","45226  >  443 [ACK] Seq=518 Ack=4097 Win=62144 Len=0"
"451","0.840559183","44.215.128.78","10.0.2.15","TCP","1434","443  >  45226 [PSH, ACK] Seq=4097 Ack=518 Win=65535 Len=1380 [TCP segment of a reassembled PDU]"
"452","0.840564061","10.0.2.15","44.215.128.78","TCP","54","45226  >  443 [ACK] Seq=518 Ack=5477 Win=63480 Len=0"
"453","0.840638109","44.215.128.78","10.0.2.15","TLSv1.3","678","Application Data, Application Data, Application Data"
"454","0.840639869","10.0.2.15","44.215.128.78","TCP","54","45226  >  443 [ACK] Seq=518 Ack=6101 Win=63480 Len=0"
"455","0.843378206","10.0.2.15","44.215.128.78","TLSv1.3","118","Change Cipher Spec, Application Data"
"456","0.843463595","44.215.128.78","10.0.2.15","TCP","60","443  >  45226 [ACK] Seq=6101 Ack=582 Win=65535 Len=0"
"457","0.843599998","10.0.2.15","44.215.128.78","TLSv1.3","977","Application Data"
"458","0.843738916","44.215.128.78","10.0.2.15","TCP","60","443  >  45226 [ACK] Seq=6101 Ack=1505 Win=65535 Len=0"
"459","0.856231966","44.215.128.78","10.0.2.15","TLSv1.3","133","Application Data"
"460","0.856237785","10.0.2.15","44.215.128.78","TCP","54","45226  >  443 [ACK] Seq=1505 Ack=6180 Win=63480 Len=0"
"461","0.856410172","44.215.128.78","10.0.2.15","TLSv1.3","133","Application Data"
"462","0.856412184","10.0.2.15","44.215.128.78","TCP","54","45226  >  443 [ACK] Seq=1505 Ack=6259 Win=63480 Len=0"
"463","0.868218642","44.215.128.78","10.0.2.15","TLSv1.3","433","Application Data"
"464","0.868223717","10.0.2.15","44.215.128.78","TCP","54","45226  >  443 [ACK] Seq=1505 Ack=6638 Win=63480 Len=0"
"660","0.989932766","10.0.2.15","142.251.35.170","TCP","74","48256  >  443 [SYN] Seq=0 Win=64240 Len=0 MSS=1460 SACK_PERM=1 TSval=2295324959 TSecr=0 WS=128"
"661","0.998950071","142.251.35.170","10.0.2.15","TCP","60","443  >  48256 [SYN, ACK] Seq=0 Ack=1 Win=65535 Len=0 MSS=1460"
"662","0.998964946","10.0.2.15","142.251.35.170","TCP","54","48256  >  443 [ACK] Seq=1 Ack=1 Win=64240 Len=0"
"665","1.007016911","10.0.2.15","142.251.35.170","TLSv1.3","726","Client Hello"
"666","1.007240486","142.251.35.170","10.0.2.15","TCP","60","443  >  48256 [ACK] Seq=1 Ack=673 Win=65535 Len=0"
"667","1.007250210","10.0.2.15","142.251.35.170","TLSv1.3","682","Change Cipher Spec, Application Data"
"669","1.007425031","142.251.35.170","10.0.2.15","TCP","60","443  >  48256 [ACK] Seq=1 Ack=1301 Win=65535 Len=0"
"672","1.026068825","142.251.35.170","10.0.2.15","TLSv1.3","822","Server Hello, Change Cipher Spec, Application Data, Application Data"
"673","1.026079085","10.0.2.15","142.251.35.170","TCP","54","48256  >  443 [ACK] Seq=1301 Ack=769 Win=63744 Len=0"
"674","1.026218446","142.251.35.170","10.0.2.15","TLSv1.3","116","Application Data"
"675","1.026224046","10.0.2.15","142.251.35.170","TCP","54","48256  >  443 [ACK] Seq=1301 Ack=831 Win=63744 Len=0"
"676","1.026469797","10.0.2.15","142.251.35.170","TLSv1.3","138","Application Data, Application Data"
"677","1.026649538","142.251.35.170","10.0.2.15","TCP","60","443  >  48256 [ACK] Seq=831 Ack=1385 Win=65535 Len=0"
"678","1.026806685","142.251.35.170","10.0.2.15","TLSv1.3","85","Application Data"
"679","1.026811454","10.0.2.15","142.251.35.170","TCP","54","48256  >  443 [ACK] Seq=1385 Ack=862 Win=63744 Len=0"
"680","1.027465884","10.0.2.15","142.251.35.170","TLSv1.3","85","Application Data"
"681","1.027556806","142.251.35.170","10.0.2.15","TCP","60","443  >  48256 [ACK] Seq=862 Ack=1416 Win=65535 Len=0"
"682","1.036648382","142.251.35.170","10.0.2.15","TLSv1.3","274","Application Data"
"683","1.036653381","10.0.2.15","142.251.35.170","TCP","54","48256  >  443 [ACK] Seq=1416 Ack=1082 Win=63744 Len=0"
"684","1.036767969","142.251.35.170","10.0.2.15","TLSv1.3","376","Application Data, Application Data"
"685","1.036775917","10.0.2.15","142.251.35.170","TCP","54","48256  >  443 [ACK] Seq=1416 Ack=1404 Win=63422 Len=0"
"686","1.036887338","10.0.2.15","142.251.35.170","TLSv1.3","93","Application Data"
"687","1.036940473","10.0.2.15","142.251.35.170","TLSv1.3","78","Application Data"
"688","1.036948380","10.0.2.15","142.251.35.170","TCP","54","48256  >  443 [FIN, ACK] Seq=1479 Ack=1404 Win=63422 Len=0"
"689","1.036992971","142.251.35.170","10.0.2.15","TCP","60","443  >  48256 [ACK] Seq=1404 Ack=1455 Win=65535 Len=0"
"690","1.037013905","142.251.35.170","10.0.2.15","TCP","60","443  >  48256 [ACK] Seq=1404 Ack=1479 Win=65535 Len=0"
"691","1.037042638","142.251.35.170","10.0.2.15","TCP","60","443  >  48256 [ACK] Seq=1404 Ack=1480 Win=65535 Len=0"
"692","1.037397805","142.251.35.170","10.0.2.15","TLSv1.3","93","Application Data"
"693","1.037407518","10.0.2.15","142.251.35.170","TCP","54","48256  >  443 [RST] Seq=1480 Win=0 Len=0"
"708","1.056401724","10.0.2.15","3.82.67.95","TCP","74","57502  >  443 [SYN] Seq=0 Win=64240 Len=0 MSS=1460 SACK_PERM=1 TSval=3534736033 TSecr=0 WS=128"
"710","1.056480190","10.0.2.15","3.82.67.95","TCP","74","57506  >  443 [SYN] Seq=0 Win=64240 Len=0 MSS=1460 SACK_PERM=1 TSval=3534736033 TSecr=0 WS=128"
"712","1.056612721","10.0.2.15","3.82.67.95","TCP","74","57516  >  443 [SYN] Seq=0 Win=64240 Len=0 MSS=1460 SACK_PERM=1 TSval=3534736033 TSecr=0 WS=128"
"714","1.059866328","10.0.2.15","108.138.112.90","TCP","74","33318  >  443 [SYN] Seq=0 Win=64240 Len=0 MSS=1460 SACK_PERM=1 TSval=2601519094 TSecr=0 WS=128"
"716","1.060847239","10.0.2.15","44.215.118.141","TCP","74","40332  >  443 [SYN] Seq=0 Win=64240 Len=0 MSS=1460 SACK_PERM=1 TSval=1553490419 TSecr=0 WS=128"
"717","1.063658238","10.0.2.15","3.82.67.95","TCP","74","57528  >  443 [SYN] Seq=0 Win=64240 Len=0 MSS=1460 SACK_PERM=1 TSval=3534736040 TSecr=0 WS=128"
"718","1.066892255","108.138.112.90","10.0.2.15","TCP","60","443  >  33318 [SYN, ACK] Seq=0 Ack=1 Win=65535 Len=0 MSS=1460"
"719","1.066902482","10.0.2.15","108.138.112.90","TCP","54","33318  >  443 [ACK] Seq=1 Ack=1 Win=64240 Len=0"
"720","1.067851487","10.0.2.15","108.138.112.90","TLSv1.3","571","Client Hello"
"721","1.067962131","108.138.112.90","10.0.2.15","TCP","60","443  >  33318 [ACK] Seq=1 Ack=518 Win=65535 Len=0"
"726","1.069674376","10.0.2.15","3.82.67.95","TCP","74","57534  >  443 [SYN] Seq=0 Win=64240 Len=0 MSS=1460 SACK_PERM=1 TSval=3534736046 TSecr=0 WS=128"
"727","1.072493188","3.82.67.95","10.0.2.15","TCP","60","443  >  57506 [SYN, ACK] Seq=0 Ack=1 Win=65535 Len=0 MSS=1460"
"728","1.072506620","10.0.2.15","3.82.67.95","TCP","54","57506  >  443 [ACK] Seq=1 Ack=1 Win=64240 Len=0"
"729","1.072699690","3.82.67.95","10.0.2.15","TCP","60","443  >  57502 [SYN, ACK] Seq=0 Ack=1 Win=65535 Len=0 MSS=1460"
"730","1.072707226","10.0.2.15","3.82.67.95","TCP","54","57502  >  443 [ACK] Seq=1 Ack=1 Win=64240 Len=0"
"731","1.073029008","3.82.67.95","10.0.2.15","TCP","60","443  >  57516 [SYN, ACK] Seq=0 Ack=1 Win=65535 Len=0 MSS=1460"
"732","1.073036412","10.0.2.15","3.82.67.95","TCP","54","57516  >  443 [ACK] Seq=1 Ack=1 Win=64240 Len=0"
"734","1.073415673","10.0.2.15","3.82.67.95","TLSv1.2","571","Client Hello"
"736","1.073503458","3.82.67.95","10.0.2.15","TCP","60","443  >  57506 [ACK] Seq=1 Ack=518 Win=65535 Len=0"
"738","1.074630487","10.0.2.15","3.82.67.95","TLSv1.2","571","Client Hello"
"739","1.074718491","3.82.67.95","10.0.2.15","TCP","60","443  >  57502 [ACK] Seq=1 Ack=518 Win=65535 Len=0"
"740","1.075516639","10.0.2.15","3.82.67.95","TLSv1.2","571","Client Hello"
"741","1.075603128","3.82.67.95","10.0.2.15","TCP","60","443  >  57516 [ACK] Seq=1 Ack=518 Win=65535 Len=0"
"742","1.076152123","10.0.2.15","3.82.67.95","TCP","74","57542  >  443 [SYN] Seq=0 Win=64240 Len=0 MSS=1460 SACK_PERM=1 TSval=3534736053 TSecr=0 WS=128"
"743","1.082568724","3.82.67.95","10.0.2.15","TCP","60","443  >  57528 [SYN, ACK] Seq=0 Ack=1 Win=65535 Len=0 MSS=1460"
"744","1.082580657","10.0.2.15","3.82.67.95","TCP","54","57528  >  443 [ACK] Seq=1 Ack=1 Win=64240 Len=0"
"745","1.082673375","44.215.118.141","10.0.2.15","TCP","60","443  >  40332 [SYN, ACK] Seq=0 Ack=1 Win=65535 Len=0 MSS=1460"
"746","1.082676241","10.0.2.15","44.215.118.141","TCP","54","40332  >  443 [ACK] Seq=1 Ack=1 Win=64240 Len=0"
"747","1.083439864","10.0.2.15","3.82.67.95","TLSv1.2","571","Client Hello"
"748","1.083537761","3.82.67.95","10.0.2.15","TCP","60","443  >  57528 [ACK] Seq=1 Ack=518 Win=65535 Len=0"
"749","1.083721027","108.138.112.90","10.0.2.15","TLSv1.3","2934","Server Hello, Change Cipher Spec, Application Data"
"750","1.083726245","10.0.2.15","108.138.112.90","TCP","54","33318  >  443 [ACK] Seq=518 Ack=2881 Win=63360 Len=0"
"751","1.084180218","108.138.112.90","10.0.2.15","TCP","1494","443  >  33318 [PSH, ACK] Seq=2881 Ack=518 Win=65535 Len=1440 [TCP segment of a reassembled PDU]"
"752","1.084186234","10.0.2.15","108.138.112.90","TCP","54","33318  >  443 [ACK] Seq=518 Ack=4321 Win=61920 Len=0"
"755","1.084418090","108.138.112.90","10.0.2.15","TLSv1.3","569","Application Data, Application Data, Application Data"
"756","1.084419051","10.0.2.15","44.215.118.141","TLSv1.3","571","Client Hello"
"757","1.084425919","10.0.2.15","108.138.112.90","TCP","54","33318  >  443 [ACK] Seq=518 Ack=4836 Win=61405 Len=0"
"758","1.084516399","44.215.118.141","10.0.2.15","TCP","60","443  >  40332 [ACK] Seq=1 Ack=518 Win=65535 Len=0"
"761","1.087243341","10.0.2.15","108.138.112.90","TLSv1.3","118","Change Cipher Spec, Application Data"
"762","1.087474211","10.0.2.15","108.138.112.90","TLSv1.3","224","Application Data"
"763","1.087565743","108.138.112.90","10.0.2.15","TCP","60","443  >  33318 [ACK] Seq=4836 Ack=752 Win=65535 Len=0"
"764","1.088349978","3.82.67.95","10.0.2.15","TCP","60","443  >  57534 [SYN, ACK] Seq=0 Ack=1 Win=65535 Len=0 MSS=1460"
"765","1.088357382","10.0.2.15","3.82.67.95","TCP","54","57534  >  443 [ACK] Seq=1 Ack=1 Win=64240 Len=0"
"766","1.089790839","10.0.2.15","3.82.67.95","TLSv1.2","571","Client Hello"
"767","1.089880358","3.82.67.95","10.0.2.15","TCP","60","443  >  57534 [ACK] Seq=1 Ack=518 Win=65535 Len=0"
"768","1.092584996","3.82.67.95","10.0.2.15","TLSv1.2","2934","Server Hello"
"769","1.092589972","10.0.2.15","3.82.67.95","TCP","54","57506  >  443 [ACK] Seq=518 Ack=2881 Win=63360 Len=0"
"770","1.092730561","3.82.67.95","10.0.2.15","TLSv1.2","1554","Certificate [TCP segment of a reassembled PDU]"
"771","1.092736215","10.0.2.15","3.82.67.95","TCP","54","57506  >  443 [ACK] Seq=518 Ack=4381 Win=61920 Len=0"
"773","1.095223872","10.0.2.15","18.173.240.180","OCSP","487","Request"
"774","1.095273791","18.173.240.180","10.0.2.15","TCP","60","80  >  33538 [ACK] Seq=1 Ack=434 Win=65535 Len=0"
"775","1.096584737","3.82.67.95","10.0.2.15","TLSv1.2","129","Server Key Exchange, Server Hello Done"
"776","1.096589527","10.0.2.15","3.82.67.95","TCP","54","57506  >  443 [ACK] Seq=518 Ack=4456 Win=63360 Len=0"
"777","1.097975378","10.0.2.15","3.82.67.95","TLSv1.2","180","Client Key Exchange, Change Cipher Spec, Encrypted Handshake Message"
"778","1.098056502","3.82.67.95","10.0.2.15","TCP","60","443  >  57506 [ACK] Seq=4456 Ack=644 Win=65535 Len=0"
"779","1.105221593","3.82.67.95","10.0.2.15","TLSv1.2","2934","Server Hello"
"780","1.105226690","10.0.2.15","3.82.67.95","TCP","54","57502  >  443 [ACK] Seq=518 Ack=2881 Win=63360 Len=0"
"781","1.105396890","3.82.67.95","10.0.2.15","TCP","60","443  >  57542 [SYN, ACK] Seq=0 Ack=1 Win=65535 Len=0 MSS=1460"
"782","1.105396945","3.82.67.95","10.0.2.15","TCP","94","443  >  57502 [PSH, ACK] Seq=2881 Ack=518 Win=65535 Len=40 [TCP segment of a reassembled PDU]"
"783","1.105406274","10.0.2.15","3.82.67.95","TCP","54","57542  >  443 [ACK] Seq=1 Ack=1 Win=64240 Len=0"
"784","1.105410868","10.0.2.15","3.82.67.95","TCP","54","57502  >  443 [ACK] Seq=518 Ack=2921 Win=63360 Len=0"
"785","1.105540128","3.82.67.95","10.0.2.15","TLSv1.2","1589","Certificate, Server Key Exchange, Server Hello Done"
"786","1.105541692","10.0.2.15","3.82.67.95","TCP","54","57502  >  443 [ACK] Seq=518 Ack=4456 Win=63360 Len=0"
"787","1.105973683","44.215.118.141","10.0.2.15","TLSv1.3","2850","Server Hello, Change Cipher Spec, Application Data"
"788","1.105976702","10.0.2.15","44.215.118.141","TCP","54","40332  >  443 [ACK] Seq=518 Ack=2797 Win=63360 Len=0"
"789","1.106054468","3.82.67.95","10.0.2.15","TLSv1.2","1514","Server Hello"
"790","1.106055835","10.0.2.15","3.82.67.95","TCP","54","57528  >  443 [ACK] Seq=518 Ack=1461 Win=63360 Len=0"
"791","1.106104857","108.138.112.90","10.0.2.15","TLSv1.3","304","Application Data, Application Data"
"792","1.106104890","3.82.67.95","10.0.2.15","TLSv1.2","1494","Server Hello"
"793","1.106106454","10.0.2.15","108.138.112.90","TCP","54","33318  >  443 [ACK] Seq=752 Ack=5086 Win=63360 Len=0"
"794","1.106110184","10.0.2.15","3.82.67.95","TCP","54","57516  >  443 [ACK] Seq=518 Ack=1441 Win=63360 Len=0"
"795","1.106135833","3.82.67.95","10.0.2.15","TCP","1494","443  >  57516 [ACK] Seq=1441 Ack=518 Win=65535 Len=1440 [TCP segment of a reassembled PDU]"
"796","1.106137944","10.0.2.15","3.82.67.95","TCP","54","57516  >  443 [ACK] Seq=518 Ack=2881 Win=63360 Len=0"
"798","1.106202803","44.215.118.141","10.0.2.15","TCP","1494","443  >  40332 [ACK] Seq=2797 Ack=518 Win=65535 Len=1440 [TCP segment of a reassembled PDU]"
"799","1.106204050","10.0.2.15","44.215.118.141","TCP","54","40332  >  443 [ACK] Seq=518 Ack=4237 Win=61920 Len=0"
"800","1.106246554","44.215.118.141","10.0.2.15","TCP","1494","443  >  40332 [ACK] Seq=4237 Ack=518 Win=65535 Len=1440 [TCP segment of a reassembled PDU]"
"801","1.106247669","10.0.2.15","44.215.118.141","TCP","54","40332  >  443 [ACK] Seq=518 Ack=5677 Win=60480 Len=0"
"802","1.106289702","44.215.118.141","10.0.2.15","TLSv1.3","611","Application Data, Application Data, Application Data"
"803","1.106290829","10.0.2.15","44.215.118.141","TCP","54","40332  >  443 [ACK] Seq=518 Ack=6234 Win=60480 Len=0"
"804","1.106328028","3.82.67.95","10.0.2.15","TLSv1.2","1494","Certificate [TCP segment of a reassembled PDU]"
"805","1.106329045","10.0.2.15","3.82.67.95","TCP","54","57516  >  443 [ACK] Seq=518 Ack=4321 Win=61920 Len=0"
"806","1.106368770","3.82.67.95","10.0.2.15","TLSv1.2","189","Server Key Exchange, Server Hello Done"
"807","1.106369809","10.0.2.15","3.82.67.95","TCP","54","57516  >  443 [ACK] Seq=518 Ack=4456 Win=61785 Len=0"
"808","1.106482921","10.0.2.15","3.82.67.95","TLSv1.2","571","Client Hello"
"809","1.106533807","3.82.67.95","10.0.2.15","TCP","60","443  >  57542 [ACK] Seq=1 Ack=518 Win=65535 Len=0"
"810","1.106638327","3.82.67.95","10.0.2.15","TCP","1494","443  >  57528 [ACK] Seq=1461 Ack=518 Win=65535 Len=1440 [TCP segment of a reassembled PDU]"
"811","1.106639606","10.0.2.15","3.82.67.95","TCP","54","57528  >  443 [ACK] Seq=518 Ack=2901 Win=61920 Len=0"
"812","1.106682526","3.82.67.95","10.0.2.15","TLSv1.2","1609","Certificate, Server Key Exchange, Server Hello Done"
"813","1.106683674","10.0.2.15","3.82.67.95","TCP","54","57528  >  443 [ACK] Seq=518 Ack=4456 Win=60480 Len=0"
"814","1.112073625","3.82.67.95","10.0.2.15","TLSv1.2","1494","Server Hello"
"815","1.112075725","10.0.2.15","3.82.67.95","TCP","54","57534  >  443 [ACK] Seq=518 Ack=1441 Win=63360 Len=0"
"816","1.112094690","3.82.67.95","10.0.2.15","TCP","1494","443  >  57534 [ACK] Seq=1441 Ack=518 Win=65535 Len=1440 [TCP segment of a reassembled PDU]"
"817","1.112095905","10.0.2.15","3.82.67.95","TCP","54","57534  >  443 [ACK] Seq=518 Ack=2881 Win=63360 Len=0"
"818","1.112185100","3.82.67.95","10.0.2.15","TLSv1.2","1629","Certificate, Server Key Exchange, Server Hello Done"
"819","1.112186468","10.0.2.15","3.82.67.95","TCP","54","57534  >  443 [ACK] Seq=518 Ack=4456 Win=61785 Len=0"
"820","1.115280566","18.173.240.180","10.0.2.15","OCSP","1124","Response"
"821","1.115285772","10.0.2.15","18.173.240.180","TCP","54","33538  >  80 [ACK] Seq=434 Ack=1071 Win=63189 Len=0"
"822","1.115618987","10.0.2.15","3.82.67.95","TLSv1.2","180","Client Key Exchange, Change Cipher Spec, Encrypted Handshake Message"
"823","1.115705097","3.82.67.95","10.0.2.15","TCP","60","443  >  57502 [ACK] Seq=4456 Ack=644 Win=65535 Len=0"
"824","1.117097331","3.82.67.95","10.0.2.15","TLSv1.2","327","New Session Ticket, Change Cipher Spec, Encrypted Handshake Message, Application Data"
"825","1.117102427","10.0.2.15","3.82.67.95","TCP","54","57506  >  443 [ACK] Seq=644 Ack=4729 Win=63360 Len=0"
"826","1.117426059","10.0.2.15","3.82.67.95","TLSv1.2","180","Client Key Exchange, Change Cipher Spec, Encrypted Handshake Message"
"830","1.117854123","10.0.2.15","108.138.112.90","TLSv1.3","85","Application Data"
"832","1.117975465","108.138.112.90","10.0.2.15","TCP","60","443  >  33318 [ACK] Seq=5086 Ack=783 Win=65535 Len=0"
"833","1.120418941","3.82.67.95","10.0.2.15","TCP","60","443  >  57516 [ACK] Seq=4456 Ack=644 Win=65535 Len=0"
"834","1.120480226","10.0.2.15","3.82.67.95","TLSv1.2","180","Client Key Exchange, Change Cipher Spec, Encrypted Handshake Message"
"836","1.121562999","3.82.67.95","10.0.2.15","TLSv1.2","1494","Server Hello"
"837","1.121567636","10.0.2.15","3.82.67.95","TCP","54","57542  >  443 [ACK] Seq=518 Ack=1441 Win=63360 Len=0"
"838","1.121602899","3.82.67.95","10.0.2.15","TCP","1494","443  >  57542 [ACK] Seq=1441 Ack=518 Win=65535 Len=1440 [TCP segment of a reassembled PDU]"
"839","1.121605240","10.0.2.15","3.82.67.95","TCP","54","57542  >  443 [ACK] Seq=518 Ack=2881 Win=63360 Len=0"
"840","1.121696415","3.82.67.95","10.0.2.15","TCP","94","443  >  57542 [PSH, ACK] Seq=2881 Ack=518 Win=65535 Len=40 [TCP segment of a reassembled PDU]"
"841","1.121697717","10.0.2.15","3.82.67.95","TCP","54","57542  >  443 [ACK] Seq=518 Ack=2921 Win=63320 Len=0"
"842","1.121802182","3.82.67.95","10.0.2.15","TCP","60","443  >  57528 [ACK] Seq=4456 Ack=644 Win=65535 Len=0"
"843","1.122231026","10.0.2.15","3.82.67.95","TLSv1.2","180","Client Key Exchange, Change Cipher Spec, Encrypted Handshake Message"
"844","1.122679080","3.82.67.95","10.0.2.15","TLSv1.2","1494","Certificate [TCP segment of a reassembled PDU]"
"845","1.122684122","10.0.2.15","3.82.67.95","TCP","54","57542  >  443 [ACK] Seq=518 Ack=4361 Win=61920 Len=0"
"846","1.122737607","3.82.67.95","10.0.2.15","TLSv1.2","149","Server Key Exchange, Server Hello Done"
"847","1.122739116","10.0.2.15","3.82.67.95","TCP","54","57542  >  443 [ACK] Seq=518 Ack=4456 Win=61825 Len=0"
"848","1.125454700","3.82.67.95","10.0.2.15","TCP","60","443  >  57534 [ACK] Seq=4456 Ack=644 Win=65535 Len=0"
"853","1.128250005","3.82.67.95","10.0.2.15","TLSv1.2","327","New Session Ticket, Change Cipher Spec, Encrypted Handshake Message, Application Data"
"854","1.128254162","10.0.2.15","3.82.67.95","TCP","54","57502  >  443 [ACK] Seq=644 Ack=4729 Win=63360 Len=0"
"856","1.130495923","3.82.67.95","10.0.2.15","TLSv1.2","327","New Session Ticket, Change Cipher Spec, Encrypted Handshake Message, Application Data"
"857","1.130500998","10.0.2.15","3.82.67.95","TCP","54","57516  >  443 [ACK] Seq=644 Ack=4729 Win=63360 Len=0"
"858","1.131524882","10.0.2.15","3.82.67.95","TLSv1.2","180","Client Key Exchange, Change Cipher Spec, Encrypted Handshake Message"
"859","1.132747984","3.82.67.95","10.0.2.15","TLSv1.2","327","New Session Ticket, Change Cipher Spec, Encrypted Handshake Message, Application Data"
"860","1.132752949","10.0.2.15","3.82.67.95","TCP","54","57528  >  443 [ACK] Seq=644 Ack=4729 Win=63360 Len=0"
"861","1.134958001","3.82.67.95","10.0.2.15","TCP","60","443  >  57542 [ACK] Seq=4456 Ack=644 Win=65535 Len=0"
"862","1.135536249","3.82.67.95","10.0.2.15","TLSv1.2","327","New Session Ticket, Change Cipher Spec, Encrypted Handshake Message, Application Data"
"863","1.135541171","10.0.2.15","3.82.67.95","TCP","54","57534  >  443 [ACK] Seq=644 Ack=4729 Win=63360 Len=0"
"864","1.136606939","10.0.2.15","44.215.118.141","TLSv1.3","118","Change Cipher Spec, Application Data"
"865","1.137443790","10.0.2.15","44.215.118.141","TLSv1.3","2843","Application Data"
"866","1.137546868","44.215.118.141","10.0.2.15","TCP","60","443  >  40332 [ACK] Seq=6234 Ack=2042 Win=65535 Len=0"
"867","1.137692392","44.215.118.141","10.0.2.15","TCP","60","443  >  40332 [ACK] Seq=6234 Ack=3371 Win=65535 Len=0"
"870","1.142504556","3.82.67.95","10.0.2.15","TLSv1.2","327","New Session Ticket, Change Cipher Spec, Encrypted Handshake Message, Application Data"
"871","1.142509938","10.0.2.15","3.82.67.95","TCP","54","57542  >  443 [ACK] Seq=644 Ack=4729 Win=63360 Len=0"
"882","1.149244806","44.215.118.141","10.0.2.15","TLSv1.3","212","Application Data, Application Data"
"883","1.149249968","10.0.2.15","44.215.118.141","TCP","54","40332  >  443 [ACK] Seq=3371 Ack=6392 Win=63360 Len=0"
"903","1.159529579","10.0.2.15","3.82.67.95","TLSv1.2","231","Application Data"
"904","1.159544913","10.0.2.15","3.82.67.95","TCP","2974","57506  >  443 [PSH, ACK] Seq=821 Ack=4729 Win=63360 Len=2920 [TCP segment of a reassembled PDU]"
"905","1.159613157","3.82.67.95","10.0.2.15","TCP","60","443  >  57506 [ACK] Seq=4729 Ack=821 Win=65535 Len=0"
"906","1.159620223","10.0.2.15","3.82.67.95","TLSv1.2","786","Application Data"
"907","1.159657181","3.82.67.95","10.0.2.15","TCP","60","443  >  57506 [ACK] Seq=4729 Ack=2281 Win=65535 Len=0"
"909","1.159694084","3.82.67.95","10.0.2.15","TCP","60","443  >  57506 [ACK] Seq=4729 Ack=3741 Win=65535 Len=0"
"910","1.159715730","3.82.67.95","10.0.2.15","TCP","60","443  >  57506 [ACK] Seq=4729 Ack=4473 Win=65535 Len=0"
"911","1.159819977","10.0.2.15","3.82.67.95","TLSv1.2","405","Application Data"
"913","1.159867730","10.0.2.15","3.82.67.95","TLSv1.2","405","Application Data"
"914","1.159916315","10.0.2.15","3.82.67.95","TLSv1.2","406","Application Data"
"915","1.159920350","3.82.67.95","10.0.2.15","TCP","60","443  >  57506 [ACK] Seq=4729 Ack=4824 Win=65535 Len=0"
"916","1.159966331","3.82.67.95","10.0.2.15","TCP","60","443  >  57506 [ACK] Seq=4729 Ack=5175 Win=65535 Len=0"
"917","1.159982947","10.0.2.15","3.82.67.95","TLSv1.2","405","Application Data"
"918","1.159996421","3.82.67.95","10.0.2.15","TCP","60","443  >  57506 [ACK] Seq=4729 Ack=5527 Win=65535 Len=0"
"919","1.160094476","3.82.67.95","10.0.2.15","TCP","60","443  >  57506 [ACK] Seq=4729 Ack=5878 Win=65535 Len=0"
"920","1.160516535","44.215.118.141","10.0.2.15","TLSv1.3","670","Application Data"
"921","1.160520626","10.0.2.15","44.215.118.141","TCP","54","40332  >  443 [ACK] Seq=3371 Ack=7008 Win=63360 Len=0"
"923","1.162388776","10.0.2.15","3.82.67.95","TLSv1.2","92","Application Data"
"925","1.162476385","3.82.67.95","10.0.2.15","TCP","60","443  >  57506 [ACK] Seq=4729 Ack=5916 Win=65535 Len=0"
"927","1.163021154","10.0.2.15","3.82.67.95","TLSv1.2","406","Application Data"
"928","1.163098833","10.0.2.15","3.82.67.95","TLSv1.2","405","Application Data"
"929","1.163109725","3.82.67.95","10.0.2.15","TCP","60","443  >  57506 [ACK] Seq=4729 Ack=6268 Win=65535 Len=0"
"930","1.163206075","3.82.67.95","10.0.2.15","TCP","60","443  >  57506 [ACK] Seq=4729 Ack=6619 Win=65535 Len=0"
"931","1.163521078","10.0.2.15","3.82.67.95","TLSv1.2","445","Application Data"
"932","1.163630332","3.82.67.95","10.0.2.15","TCP","60","443  >  57506 [ACK] Seq=4729 Ack=7010 Win=65535 Len=0"
"935","1.164614584","10.0.2.15","3.82.67.95","TLSv1.2","248","Application Data"
"936","1.164696219","3.82.67.95","10.0.2.15","TCP","60","443  >  57542 [ACK] Seq=4729 Ack=838 Win=65535 Len=0"
"937","1.166036683","10.0.2.15","3.82.67.95","TLSv1.2","405","Application Data"
"938","1.166113169","10.0.2.15","3.82.67.95","TLSv1.2","85","Encrypted Alert"
"939","1.166121777","10.0.2.15","3.82.67.95","TCP","54","57542  >  443 [FIN, ACK] Seq=869 Ack=4729 Win=63360 Len=0"
"940","1.166125651","3.82.67.95","10.0.2.15","TCP","60","443  >  57506 [ACK] Seq=4729 Ack=7361 Win=65535 Len=0"
"941","1.166206543","10.0.2.15","104.26.10.184","TLSv1.2","93","Application Data"
"942","1.166269073","3.82.67.95","10.0.2.15","TCP","60","443  >  57542 [ACK] Seq=4729 Ack=869 Win=65535 Len=0"
"943","1.166269161","3.82.67.95","10.0.2.15","TCP","60","443  >  57542 [ACK] Seq=4729 Ack=870 Win=65535 Len=0"
"945","1.166407970","10.0.2.15","104.26.9.50","TLSv1.2","93","Application Data"
"946","1.166438923","10.0.2.15","172.67.68.136","TLSv1.2","93","Application Data"
"947","1.166461799","104.26.10.184","10.0.2.15","TCP","60","443  >  33218 [ACK] Seq=1 Ack=40 Win=65535 Len=0"
"949","1.166517417","104.26.9.50","10.0.2.15","TCP","60","443  >  33554 [ACK] Seq=1 Ack=40 Win=65535 Len=0"
"950","1.166517449","172.67.68.136","10.0.2.15","TCP","60","443  >  51704 [ACK] Seq=1 Ack=40 Win=65535 Len=0"
"954","1.166776796","10.0.2.15","172.67.68.136","TLSv1.2","78","Application Data"
"955","1.166783872","10.0.2.15","172.67.68.136","TCP","54","51704  >  443 [FIN, ACK] Seq=64 Ack=1 Win=63360 Len=0"
"957","1.166854721","172.67.68.136","10.0.2.15","TCP","60","443  >  51704 [ACK] Seq=1 Ack=64 Win=65535 Len=0"
"958","1.166882327","172.67.68.136","10.0.2.15","TCP","60","443  >  51704 [ACK] Seq=1 Ack=65 Win=65535 Len=0"
"959","1.166923305","10.0.2.15","104.26.9.50","TLSv1.2","78","Application Data"
"960","1.166930338","10.0.2.15","104.26.9.50","TCP","54","33554  >  443 [FIN, ACK] Seq=64 Ack=1 Win=63360 Len=0"
"961","1.166998943","104.26.9.50","10.0.2.15","TCP","60","443  >  33554 [ACK] Seq=1 Ack=64 Win=65535 Len=0"
"962","1.167040315","10.0.2.15","104.26.10.184","TLSv1.2","78","Application Data"
"963","1.167045040","10.0.2.15","104.26.10.184","TCP","54","33218  >  443 [FIN, ACK] Seq=64 Ack=1 Win=63360 Len=0"
"964","1.167059877","104.26.9.50","10.0.2.15","TCP","60","443  >  33554 [ACK] Seq=1 Ack=65 Win=65535 Len=0"
"965","1.167155187","104.26.10.184","10.0.2.15","TCP","60","443  >  33218 [ACK] Seq=1 Ack=64 Win=65535 Len=0"
"966","1.167155241","104.26.10.184","10.0.2.15","TCP","60","443  >  33218 [ACK] Seq=1 Ack=65 Win=65535 Len=0"
"969","1.168699759","10.0.2.15","18.173.240.180","OCSP","487","Request"
"970","1.168849797","18.173.240.180","10.0.2.15","TCP","60","80  >  33520 [ACK] Seq=1 Ack=434 Win=65535 Len=0"
"971","1.170267436","10.0.2.15","18.173.240.180","OCSP","487","Request"
"972","1.170398671","18.173.240.180","10.0.2.15","TCP","60","80  >  33538 [ACK] Seq=1071 Ack=867 Win=65535 Len=0"
"974","1.177119506","3.82.67.95","10.0.2.15","TLSv1.2","92","Application Data"
"975","1.177149518","10.0.2.15","3.82.67.95","TCP","54","57506  >  443 [ACK] Seq=7361 Ack=4767 Win=63360 Len=0"
"983","1.177565704","3.82.67.95","10.0.2.15","TLSv1.2","262","Application Data, Application Data"
"984","1.177565748","104.26.10.184","10.0.2.15","TCP","60","443  >  33218 [FIN, ACK] Seq=1 Ack=65 Win=65535 Len=0"
"985","1.177571512","10.0.2.15","104.26.10.184","TCP","54","33218  >  443 [ACK] Seq=65 Ack=2 Win=63360 Len=0"
"987","1.177658058","10.0.2.15","3.82.67.95","TCP","54","57506  >  443 [ACK] Seq=7361 Ack=4975 Win=63360 Len=0"
"992","1.178175219","10.0.2.15","18.173.240.180","TCP","74","34900  >  80 [SYN] Seq=0 Win=64240 Len=0 MSS=1460 SACK_PERM=1 TSval=3999870823 TSecr=0 WS=128"
"993","1.178256379","3.82.67.95","10.0.2.15","TLSv1.2","883","Application Data, Application Data, Application Data, Application Data, Application Data, Application Data, Application Data, Application Data"
"994","1.178256467","172.67.68.136","10.0.2.15","TCP","60","443  >  51704 [FIN, ACK] Seq=1 Ack=65 Win=65535 Len=0"
"995","1.178256489","104.26.9.50","10.0.2.15","TCP","60","443  >  33554 [FIN, ACK] Seq=1 Ack=65 Win=65535 Len=0"
"996","1.178289936","10.0.2.15","172.67.68.136","TCP","54","51704  >  443 [ACK] Seq=65 Ack=2 Win=63360 Len=0"
"997","1.178297450","10.0.2.15","104.26.9.50","TCP","54","33554  >  443 [ACK] Seq=65 Ack=2 Win=63360 Len=0"
"998","1.178488212","10.0.2.15","3.82.67.95","TCP","54","57506  >  443 [ACK] Seq=7361 Ack=5804 Win=63360 Len=0"
"999","1.178551016","3.82.67.95","10.0.2.15","TLSv1.2","92","Application Data"
"1000","1.178556835","10.0.2.15","3.82.67.95","TCP","54","57542  >  443 [RST] Seq=870 Win=0 Len=0"
"1001","1.178642301","3.82.67.95","10.0.2.15","TCP","60","443  >  57542 [FIN, ACK] Seq=4767 Ack=870 Win=65535 Len=0"
"1002","1.178644292","10.0.2.15","3.82.67.95","TCP","54","57542  >  443 [RST] Seq=870 Win=0 Len=0"
"1003","1.178741920","3.82.67.95","10.0.2.15","TCP","60","443  >  57542 [RST, ACK] Seq=4068663295 Ack=870 Win=0 Len=0"
"1004","1.179498708","10.0.2.15","18.173.240.180","TCP","74","34906  >  80 [SYN] Seq=0 Win=64240 Len=0 MSS=1460 SACK_PERM=1 TSval=3999870824 TSecr=0 WS=128"
"1009","1.185014083","18.173.240.180","10.0.2.15","TCP","60","80  >  34906 [SYN, ACK] Seq=0 Ack=1 Win=65535 Len=0 MSS=1460"
"1010","1.185025327","10.0.2.15","18.173.240.180","TCP","54","34906  >  80 [ACK] Seq=1 Ack=1 Win=64240 Len=0"
"1011","1.185149368","10.0.2.15","18.173.240.180","OCSP","487","Request"
"1012","1.185290071","18.173.240.180","10.0.2.15","TCP","60","80  >  34906 [ACK] Seq=1 Ack=434 Win=65535 Len=0"
"1013","1.185439620","18.173.240.180","10.0.2.15","TCP","60","80  >  34900 [SYN, ACK] Seq=0 Ack=1 Win=65535 Len=0 MSS=1460"
"1014","1.185448534","10.0.2.15","18.173.240.180","TCP","54","34900  >  80 [ACK] Seq=1 Ack=1 Win=64240 Len=0"
"1015","1.185574763","10.0.2.15","18.173.240.180","OCSP","487","Request"
"1016","1.185632996","18.173.240.180","10.0.2.15","TCP","60","80  >  34900 [ACK] Seq=1 Ack=434 Win=65535 Len=0"
"1026","1.201324003","18.173.240.180","10.0.2.15","OCSP","1124","Response"
