"No.","Time","Source","Destination","Protocol","Length","Info"
"1","0.000000000","10.0.2.15","34.206.214.13","TLSv1.2","631","Application Data"
"2","0.000186451","34.206.214.13","10.0.2.15","TCP","60","443  >  49560 [ACK] Seq=1 Ack=578 Win=65535 Len=0"
"3","0.013868760","10.0.2.15","34.206.214.13","TLSv1.2","582","Application Data"
"4","0.013977012","34.206.214.13","10.0.2.15","TCP","60","443  >  49560 [ACK] Seq=1 Ack=1106 Win=65535 Len=0"
"5","0.016888810","34.206.214.13","10.0.2.15","TLSv1.2","275","Application Data, Application Data"
"6","0.016897428","10.0.2.15","34.206.214.13","TCP","54","49560  >  443 [ACK] Seq=1106 Ack=222 Win=63360 Len=0"
"7","0.029700978","34.206.214.13","10.0.2.15","TLSv1.2","275","Application Data, Application Data"
"8","0.029708470","10.0.2.15","34.206.214.13","TCP","54","49560  >  443 [ACK] Seq=1106 Ack=443 Win=63360 Len=0"
"9","0.147495457","10.0.2.15","142.251.41.3","TCP","54","58130  >  80 [ACK] Seq=1 Ack=1 Win=63916 Len=0"
"10","0.147603137","142.251.41.3","10.0.2.15","TCP","60","[TCP ACKed unseen segment] 80  >  58130 [ACK] Seq=1 Ack=2 Win=65535 Len=0"
"11","0.350602786","10.0.2.15","34.206.214.13","TLSv1.2","583","Application Data"
"12","0.350795478","34.206.214.13","10.0.2.15","TCP","60","443  >  49560 [ACK] Seq=443 Ack=1635 Win=65535 Len=0"
"13","0.367617938","34.206.214.13","10.0.2.15","TLSv1.2","275","Application Data, Application Data"
"14","0.367629477","10.0.2.15","34.206.214.13","TCP","54","49560  >  443 [ACK] Seq=1635 Ack=664 Win=63360 Len=0"
"15","0.399502147","10.0.2.15","142.251.41.3","TCP","54","58118  >  80 [ACK] Seq=1 Ack=1 Win=63916 Len=0"
"16","0.399591418","142.251.41.3","10.0.2.15","TCP","60","[TCP ACKed unseen segment] 80  >  58118 [ACK] Seq=1 Ack=2 Win=65535 Len=0"
"17","0.734918712","10.0.2.15","199.232.91.5","TCP","74","54810  >  80 [SYN] Seq=0 Win=64240 Len=0 MSS=1460 SACK_PERM=1 TSval=2990727225 TSecr=0 WS=128"
"18","0.741069393","199.232.91.5","10.0.2.15","TCP","60","80  >  54810 [SYN, ACK] Seq=0 Ack=1 Win=65535 Len=0 MSS=1460"
"19","0.741088960","10.0.2.15","199.232.91.5","TCP","54","54810  >  80 [ACK] Seq=1 Ack=1 Win=64240 Len=0"
"20","0.808014266","10.0.2.15","99.83.181.31","TLSv1.2","138","Application Data"
"21","0.808037935","10.0.2.15","99.83.181.31","TLSv1.2","438","Application Data"
"22","0.808183862","99.83.181.31","10.0.2.15","TCP","60","443  >  40876 [ACK] Seq=1 Ack=85 Win=65535 Len=0"
"23","0.808220066","99.83.181.31","10.0.2.15","TCP","60","443  >  40876 [ACK] Seq=1 Ack=469 Win=65535 Len=0"
"24","0.829333899","10.0.2.15","3.233.158.24","TLSv1.2","317","Application Data"
"25","0.829378664","10.0.2.15","3.233.158.24","TLSv1.2","540","Application Data"
"26","0.829419975","3.233.158.24","10.0.2.15","TCP","60","443  >  53554 [ACK] Seq=1 Ack=264 Win=65535 Len=0"
"27","0.829462599","3.233.158.24","10.0.2.15","TCP","60","443  >  53554 [ACK] Seq=1 Ack=750 Win=65535 Len=0"
"28","0.835598854","99.83.181.31","10.0.2.15","TLSv1.2","155","Application Data"
"29","0.835604673","10.0.2.15","99.83.181.31","TCP","54","40876  >  443 [ACK] Seq=469 Ack=102 Win=63360 Len=0"
"30","0.867747663","3.233.158.24","10.0.2.15","TLSv1.2","211","Application Data"
"31","0.867754663","10.0.2.15","3.233.158.24","TCP","54","53554  >  443 [ACK] Seq=750 Ack=158 Win=63360 Len=0"
"32","0.878476628","10.0.2.15","23.43.85.24","TCP","74","35268  >  443 [SYN] Seq=0 Win=64240 Len=0 MSS=1460 SACK_PERM=1 TSval=3856780383 TSecr=0 WS=128"
"33","0.886408974","23.43.85.24","10.0.2.15","TCP","60","443  >  35268 [SYN, ACK] Seq=0 Ack=1 Win=65535 Len=0 MSS=1460"
"34","0.886421082","10.0.2.15","23.43.85.24","TCP","54","35268  >  443 [ACK] Seq=1 Ack=1 Win=64240 Len=0"
"35","0.892456726","10.0.2.15","23.43.85.24","TLSv1.3","724","Client Hello"
"36","0.892547387","23.43.85.24","10.0.2.15","TCP","60","443  >  35268 [ACK] Seq=1 Ack=671 Win=65535 Len=0"
"37","0.900023994","10.0.2.15","23.204.152.134","TCP","74","55888  >  443 [SYN] Seq=0 Win=64240 Len=0 MSS=1460 SACK_PERM=1 TSval=963695462 TSecr=0 WS=128"
"38","0.904426106","23.43.85.24","10.0.2.15","TLSv1.3","324","Server Hello, Change Cipher Spec, Application Data, Application Data"
"39","0.904431509","10.0.2.15","23.43.85.24","TCP","54","35268  >  443 [ACK] Seq=671 Ack=271 Win=63970 Len=0"
"40","0.904845105","10.0.2.15","23.43.85.24","TLSv1.3","134","Change Cipher Spec, Application Data"
"41","0.904916569","23.43.85.24","10.0.2.15","TCP","60","443  >  35268 [ACK] Seq=271 Ack=751 Win=65535 Len=0"
"42","0.906735259","23.204.152.134","10.0.2.15","TCP","60","443  >  55888 [SYN, ACK] Seq=0 Ack=1 Win=65535 Len=0 MSS=1460"
"43","0.906745912","10.0.2.15","23.204.152.134","TCP","54","55888  >  443 [ACK] Seq=1 Ack=1 Win=64240 Len=0"
"44","0.907930692","10.0.2.15","23.204.152.134","TLSv1.3","734","Client Hello"
"45","0.908084004","23.204.152.134","10.0.2.15","TCP","60","443  >  55888 [ACK] Seq=1 Ack=681 Win=65535 Len=0"
"46","0.911952266","10.0.2.15","23.43.85.142","TCP","54","43464  >  80 [ACK] Seq=1 Ack=1 Win=63350 Len=0"
"47","0.911961913","10.0.2.15","52.86.20.97","TCP","54","51766  >  443 [ACK] Seq=1 Ack=1 Win=63360 Len=0"
"48","0.912028652","23.43.85.142","10.0.2.15","TCP","60","[TCP ACKed unseen segment] 80  >  43464 [ACK] Seq=1 Ack=2 Win=65535 Len=0"
"49","0.912052070","52.86.20.97","10.0.2.15","TCP","60","[TCP ACKed unseen segment] 443  >  51766 [ACK] Seq=1 Ack=2 Win=65535 Len=0"
"50","0.912456861","23.43.85.24","10.0.2.15","TLSv1.3","341","Application Data"
"51","0.912462329","10.0.2.15","23.43.85.24","TCP","54","35268  >  443 [ACK] Seq=751 Ack=558 Win=63970 Len=0"
"52","0.917826519","10.0.2.15","23.204.12.188","TLSv1.2","3758","Application Data"
"53","0.917925537","23.204.12.188","10.0.2.15","TCP","60","443  >  38456 [ACK] Seq=1 Ack=1461 Win=65535 Len=0"
"54","0.917925592","23.204.12.188","10.0.2.15","TCP","60","443  >  38456 [ACK] Seq=1 Ack=2921 Win=65535 Len=0"
"55","0.917973433","23.204.12.188","10.0.2.15","TCP","60","443  >  38456 [ACK] Seq=1 Ack=3705 Win=65535 Len=0"
"56","0.920748014","23.204.152.134","10.0.2.15","TLSv1.3","324","Server Hello, Change Cipher Spec, Application Data, Application Data"
"57","0.920753504","10.0.2.15","23.204.152.134","TCP","54","55888  >  443 [ACK] Seq=681 Ack=271 Win=63970 Len=0"
"58","0.921095870","10.0.2.15","23.204.152.134","TLSv1.3","134","Change Cipher Spec, Application Data"
"59","0.921181665","23.204.152.134","10.0.2.15","TCP","60","443  >  55888 [ACK] Seq=271 Ack=761 Win=65535 Len=0"
"60","0.931467762","23.204.152.134","10.0.2.15","TLSv1.3","341","Application Data"
"61","0.931473077","10.0.2.15","23.204.152.134","TCP","54","55888  >  443 [ACK] Seq=761 Ack=558 Win=63970 Len=0"
"62","1.123015653","10.0.2.15","18.164.124.24","TLSv1.2","3800","Application Data"
"63","1.123117799","18.164.124.24","10.0.2.15","TCP","60","443  >  45190 [ACK] Seq=1 Ack=1461 Win=65535 Len=0"
"64","1.123173405","18.164.124.24","10.0.2.15","TCP","60","443  >  45190 [ACK] Seq=1 Ack=2921 Win=65535 Len=0"
"65","1.123173460","18.164.124.24","10.0.2.15","TCP","60","443  >  45190 [ACK] Seq=1 Ack=3747 Win=65535 Len=0"
"66","1.126782139","10.0.2.15","18.164.124.24","TLSv1.2","89","Application Data"
"67","1.126881039","18.164.124.24","10.0.2.15","TCP","60","443  >  45190 [ACK] Seq=1 Ack=3782 Win=65535 Len=0"
"68","1.129967315","18.164.124.24","10.0.2.15","TCP","2934","443  >  45190 [ACK] Seq=1 Ack=3782 Win=65535 Len=2880 [TCP segment of a reassembled PDU]"
"69","1.129973374","10.0.2.15","18.164.124.24","TCP","54","45190  >  443 [ACK] Seq=3782 Ack=2881 Win=65535 Len=0"
"70","1.130013231","18.164.124.24","10.0.2.15","TCP","1494","443  >  45190 [ACK] Seq=2881 Ack=3782 Win=65535 Len=1440 [TCP segment of a reassembled PDU]"
"71","1.130016009","10.0.2.15","18.164.124.24","TCP","54","45190  >  443 [ACK] Seq=3782 Ack=4321 Win=65535 Len=0"
"72","1.130059289","18.164.124.24","10.0.2.15","TCP","1494","443  >  45190 [ACK] Seq=4321 Ack=3782 Win=65535 Len=1440 [TCP segment of a reassembled PDU]"
"73","1.130060711","10.0.2.15","18.164.124.24","TCP","54","45190  >  443 [ACK] Seq=3782 Ack=5761 Win=65535 Len=0"
"74","1.130084773","18.164.124.24","10.0.2.15","TCP","1494","443  >  45190 [PSH, ACK] Seq=5761 Ack=3782 Win=65535 Len=1440 [TCP segment of a reassembled PDU]"
"75","1.130086064","10.0.2.15","18.164.124.24","TCP","54","45190  >  443 [ACK] Seq=3782 Ack=7201 Win=65535 Len=0"
"76","1.130192202","18.164.124.24","10.0.2.15","TCP","1494","443  >  45190 [ACK] Seq=7201 Ack=3782 Win=65535 Len=1440 [TCP segment of a reassembled PDU]"
"77","1.130200701","10.0.2.15","18.164.124.24","TCP","54","45190  >  443 [ACK] Seq=3782 Ack=8641 Win=65535 Len=0"
"78","1.130239420","18.164.124.24","10.0.2.15","TCP","1494","443  >  45190 [ACK] Seq=8641 Ack=3782 Win=65535 Len=1440 [TCP segment of a reassembled PDU]"
"79","1.130267934","18.164.124.24","10.0.2.15","TCP","1494","443  >  45190 [ACK] Seq=10081 Ack=3782 Win=65535 Len=1440 [TCP segment of a reassembled PDU]"
"80","1.130269553","10.0.2.15","18.164.124.24","TCP","54","45190  >  443 [ACK] Seq=3782 Ack=10081 Win=65535 Len=0"
"81","1.130272145","10.0.2.15","18.164.124.24","TCP","54","45190  >  443 [ACK] Seq=3782 Ack=11521 Win=65535 Len=0"
"82","1.130314845","18.164.124.24","10.0.2.15","TCP","1494","443  >  45190 [ACK] Seq=11521 Ack=3782 Win=65535 Len=1440 [TCP segment of a reassembled PDU]"
"83","1.130315917","10.0.2.15","18.164.124.24","TCP","54","45190  >  443 [ACK] Seq=3782 Ack=12961 Win=65535 Len=0"
"84","1.130361363","18.164.124.24","10.0.2.15","TCP","1494","443  >  45190 [ACK] Seq=12961 Ack=3782 Win=65535 Len=1440 [TCP segment of a reassembled PDU]"
"85","1.130362522","10.0.2.15","18.164.124.24","TCP","54","45190  >  443 [ACK] Seq=3782 Ack=14401 Win=65535 Len=0"
"86","1.130490317","18.164.124.24","10.0.2.15","TLSv1.2","2060","Application Data"
"87","1.130496310","10.0.2.15","18.164.124.24","TCP","54","45190  >  443 [ACK] Seq=3782 Ack=16407 Win=65535 Len=0"
"88","1.130563905","18.164.124.24","10.0.2.15","TCP","2934","443  >  45190 [ACK] Seq=16407 Ack=3782 Win=65535 Len=2880 [TCP segment of a reassembled PDU]"
"89","1.130603553","18.164.124.24","10.0.2.15","TCP","1494","443  >  45190 [ACK] Seq=19287 Ack=3782 Win=65535 Len=1440 [TCP segment of a reassembled PDU]"
"90","1.130644219","18.164.124.24","10.0.2.15","TCP","1494","443  >  45190 [ACK] Seq=20727 Ack=3782 Win=65535 Len=1440 [TCP segment of a reassembled PDU]"
"91","1.130647074","10.0.2.15","18.164.124.24","TCP","54","45190  >  443 [ACK] Seq=3782 Ack=19287 Win=65535 Len=0"
"92","1.130647435","10.0.2.15","18.164.124.24","TCP","54","45190  >  443 [ACK] Seq=3782 Ack=20727 Win=65535 Len=0"
"93","1.130692137","18.164.124.24","10.0.2.15","TCP","1494","443  >  45190 [ACK] Seq=22167 Ack=3782 Win=65535 Len=1440 [TCP segment of a reassembled PDU]"
"94","1.130734772","18.164.124.24","10.0.2.15","TCP","1494","443  >  45190 [ACK] Seq=23607 Ack=3782 Win=65535 Len=1440 [TCP segment of a reassembled PDU]"
"95","1.130736959","10.0.2.15","18.164.124.24","TCP","54","45190  >  443 [ACK] Seq=3782 Ack=22167 Win=65535 Len=0"
"96","1.130737320","10.0.2.15","18.164.124.24","TCP","54","45190  >  443 [ACK] Seq=3782 Ack=23607 Win=65535 Len=0"
"97","1.130737582","10.0.2.15","18.164.124.24","TCP","54","45190  >  443 [ACK] Seq=3782 Ack=25047 Win=65535 Len=0"
"98","1.130773337","18.164.124.24","10.0.2.15","TCP","1494","443  >  45190 [ACK] Seq=25047 Ack=3782 Win=65535 Len=1440 [TCP segment of a reassembled PDU]"
"99","1.130834063","18.164.124.24","10.0.2.15","TCP","1494","443  >  45190 [ACK] Seq=26487 Ack=3782 Win=65535 Len=1440 [TCP segment of a reassembled PDU]"
"100","1.130887963","18.164.124.24","10.0.2.15","TCP","1494","443  >  45190 [ACK] Seq=27927 Ack=3782 Win=65535 Len=1440 [TCP segment of a reassembled PDU]"
"101","1.130936351","18.164.124.24","10.0.2.15","TCP","1494","443  >  45190 [ACK] Seq=29367 Ack=3782 Win=65535 Len=1440 [TCP segment of a reassembled PDU]"
"102","1.130979839","18.164.124.24","10.0.2.15","TCP","1494","443  >  45190 [ACK] Seq=30807 Ack=3782 Win=65535 Len=1440 [TCP segment of a reassembled PDU]"
"103","1.131030261","18.164.124.24","10.0.2.15","TLSv1.2","1494","Application Data [TCP segment of a reassembled PDU]"
"104","1.131031694","10.0.2.15","18.164.124.24","TCP","54","45190  >  443 [ACK] Seq=3782 Ack=26487 Win=65535 Len=0"
"105","1.131031978","10.0.2.15","18.164.124.24","TCP","54","45190  >  443 [ACK] Seq=3782 Ack=27927 Win=65535 Len=0"
"106","1.131071069","18.164.124.24","10.0.2.15","TCP","1494","443  >  45190 [ACK] Seq=33687 Ack=3782 Win=65535 Len=1440 [TCP segment of a reassembled PDU]"
"107","1.131072721","10.0.2.15","18.164.124.24","TCP","54","45190  >  443 [ACK] Seq=3782 Ack=29367 Win=65535 Len=0"
"108","1.131073060","10.0.2.15","18.164.124.24","TCP","54","45190  >  443 [ACK] Seq=3782 Ack=30807 Win=65535 Len=0"
"109","1.131073476","10.0.2.15","18.164.124.24","TCP","54","45190  >  443 [ACK] Seq=3782 Ack=32247 Win=65535 Len=0"
"110","1.131073760","10.0.2.15","18.164.124.24","TCP","54","45190  >  443 [ACK] Seq=3782 Ack=33687 Win=65535 Len=0"
"111","1.131073979","10.0.2.15","18.164.124.24","TCP","54","45190  >  443 [ACK] Seq=3782 Ack=35127 Win=65535 Len=0"
"112","1.131119304","18.164.124.24","10.0.2.15","TCP","1494","443  >  45190 [ACK] Seq=35127 Ack=3782 Win=65535 Len=1440 [TCP segment of a reassembled PDU]"
"113","1.131162070","18.164.124.24","10.0.2.15","TCP","620","443  >  45190 [PSH, ACK] Seq=36567 Ack=3782 Win=65535 Len=566 [TCP segment of a reassembled PDU]"
"114","1.131302193","10.0.2.15","18.164.124.24","TCP","54","45190  >  443 [ACK] Seq=3782 Ack=36567 Win=65535 Len=0"
"115","1.131304162","10.0.2.15","18.164.124.24","TCP","54","45190  >  443 [ACK] Seq=3782 Ack=37133 Win=65535 Len=0"
"116","1.131364240","18.164.124.24","10.0.2.15","TCP","1494","443  >  45190 [ACK] Seq=37133 Ack=3782 Win=65535 Len=1440 [TCP segment of a reassembled PDU]"
"117","1.131369064","10.0.2.15","18.164.124.24","TCP","54","45190  >  443 [ACK] Seq=3782 Ack=38573 Win=65535 Len=0"
"118","1.131417736","18.164.124.24","10.0.2.15","TCP","1494","443  >  45190 [ACK] Seq=38573 Ack=3782 Win=65535 Len=1440 [TCP segment of a reassembled PDU]"
"119","1.131422198","10.0.2.15","18.164.124.24","TCP","54","45190  >  443 [ACK] Seq=3782 Ack=40013 Win=65535 Len=0"
"120","1.131445802","18.164.124.24","10.0.2.15","TCP","1494","443  >  45190 [ACK] Seq=40013 Ack=3782 Win=65535 Len=1440 [TCP segment of a reassembled PDU]"
"121","1.131447016","10.0.2.15","18.164.124.24","TCP","54","45190  >  443 [ACK] Seq=3782 Ack=41453 Win=65535 Len=0"
"122","1.131497351","18.164.124.24","10.0.2.15","TCP","1494","443  >  45190 [ACK] Seq=41453 Ack=3782 Win=65535 Len=1440 [TCP segment of a reassembled PDU]"
"123","1.131498685","10.0.2.15","18.164.124.24","TCP","54","45190  >  443 [ACK] Seq=3782 Ack=42893 Win=65535 Len=0"
"124","1.131552640","18.164.124.24","10.0.2.15","TCP","1494","443  >  45190 [ACK] Seq=42893 Ack=3782 Win=65535 Len=1440 [TCP segment of a reassembled PDU]"
"125","1.131553821","10.0.2.15","18.164.124.24","TCP","54","45190  >  443 [ACK] Seq=3782 Ack=44333 Win=65535 Len=0"
"126","1.131604626","18.164.124.24","10.0.2.15","TCP","1494","443  >  45190 [ACK] Seq=44333 Ack=3782 Win=65535 Len=1440 [TCP segment of a reassembled PDU]"
"127","1.131605753","10.0.2.15","18.164.124.24","TCP","54","45190  >  443 [ACK] Seq=3782 Ack=45773 Win=65535 Len=0"
"128","1.131646309","18.164.124.24","10.0.2.15","TCP","1494","443  >  45190 [ACK] Seq=45773 Ack=3782 Win=65535 Len=1440 [TCP segment of a reassembled PDU]"
"129","1.131649820","10.0.2.15","18.164.124.24","TCP","54","45190  >  443 [ACK] Seq=3782 Ack=47213 Win=65535 Len=0"
"130","1.131699862","18.164.124.24","10.0.2.15","TCP","1494","443  >  45190 [ACK] Seq=47213 Ack=3782 Win=65535 Len=1440 [TCP segment of a reassembled PDU]"
"131","1.131706630","10.0.2.15","18.164.124.24","TCP","54","45190  >  443 [ACK] Seq=3782 Ack=48653 Win=65535 Len=0"
"132","1.131739259","18.164.124.24","10.0.2.15","TLSv1.2","1494","Application Data [TCP segment of a reassembled PDU]"
"133","1.131784081","18.164.124.24","10.0.2.15","TCP","1494","443  >  45190 [ACK] Seq=50093 Ack=3782 Win=65535 Len=1440 [TCP segment of a reassembled PDU]"
"134","1.131889322","18.164.124.24","10.0.2.15","TCP","1494","443  >  45190 [ACK] Seq=51533 Ack=3782 Win=65535 Len=1440 [TCP segment of a reassembled PDU]"
"135","1.131917170","18.164.124.24","10.0.2.15","TCP","1494","443  >  45190 [ACK] Seq=52973 Ack=3782 Win=65535 Len=1440 [TCP segment of a reassembled PDU]"
"136","1.131918602","10.0.2.15","18.164.124.24","TCP","54","45190  >  443 [ACK] Seq=3782 Ack=50093 Win=65535 Len=0"
"137","1.131923218","10.0.2.15","18.164.124.24","TCP","54","45190  >  443 [ACK] Seq=3782 Ack=51533 Win=65535 Len=0"
"138","1.131923655","10.0.2.15","18.164.124.24","TCP","54","45190  >  443 [ACK] Seq=3782 Ack=52973 Win=65535 Len=0"
"139","1.131923896","10.0.2.15","18.164.124.24","TCP","54","45190  >  443 [ACK] Seq=3782 Ack=54413 Win=65535 Len=0"
"140","1.131948790","18.164.124.24","10.0.2.15","TCP","1494","443  >  45190 [ACK] Seq=54413 Ack=3782 Win=65535 Len=1440 [TCP segment of a reassembled PDU]"
"141","1.131949928","10.0.2.15","18.164.124.24","TCP","54","45190  >  443 [ACK] Seq=3782 Ack=55853 Win=65535 Len=0"
"142","1.132006092","18.164.124.24","10.0.2.15","TCP","1494","443  >  45190 [ACK] Seq=55853 Ack=3782 Win=65535 Len=1440 [TCP segment of a reassembled PDU]"
"143","1.132009592","10.0.2.15","18.164.124.24","TCP","54","45190  >  443 [ACK] Seq=3782 Ack=57293 Win=65535 Len=0"
"144","1.132039703","18.164.124.24","10.0.2.15","TCP","1494","443  >  45190 [ACK] Seq=57293 Ack=3782 Win=65535 Len=1440 [TCP segment of a reassembled PDU]"
"145","1.132041180","10.0.2.15","18.164.124.24","TCP","54","45190  >  443 [ACK] Seq=3782 Ack=58733 Win=65535 Len=0"
"146","1.132099324","18.164.124.24","10.0.2.15","TCP","1494","443  >  45190 [ACK] Seq=58733 Ack=3782 Win=65535 Len=1440 [TCP segment of a reassembled PDU]"
"147","1.132102769","10.0.2.15","18.164.124.24","TCP","54","45190  >  443 [ACK] Seq=3782 Ack=60173 Win=65535 Len=0"
"148","1.132183552","18.164.124.24","10.0.2.15","TCP","2934","443  >  45190 [ACK] Seq=60173 Ack=3782 Win=65535 Len=2880 [TCP segment of a reassembled PDU]"
"149","1.132188474","10.0.2.15","18.164.124.24","TCP","54","45190  >  443 [ACK] Seq=3782 Ack=63053 Win=65535 Len=0"
"150","1.132223081","18.164.124.24","10.0.2.15","TLSv1.2","2626","Application Data"
"151","1.132224612","10.0.2.15","18.164.124.24","TCP","54","45190  >  443 [ACK] Seq=3782 Ack=65625 Win=65535 Len=0"
"152","1.132288137","18.164.124.24","10.0.2.15","TCP","1494","443  >  45190 [ACK] Seq=65625 Ack=3782 Win=65535 Len=1440 [TCP segment of a reassembled PDU]"
"153","1.132291604","10.0.2.15","18.164.124.24","TCP","54","45190  >  443 [ACK] Seq=3782 Ack=67065 Win=65535 Len=0"
"154","1.132325784","18.164.124.24","10.0.2.15","TCP","1494","443  >  45190 [ACK] Seq=67065 Ack=3782 Win=65535 Len=1440 [TCP segment of a reassembled PDU]"
"155","1.132327217","10.0.2.15","18.164.124.24","TCP","54","45190  >  443 [ACK] Seq=3782 Ack=68505 Win=65535 Len=0"
"156","1.132353216","18.164.124.24","10.0.2.15","TCP","2934","443  >  45190 [ACK] Seq=68505 Ack=3782 Win=65535 Len=2880 [TCP segment of a reassembled PDU]"
"157","1.132354758","10.0.2.15","18.164.124.24","TCP","54","45190  >  443 [ACK] Seq=3782 Ack=71385 Win=65535 Len=0"
"158","1.132437567","18.164.124.24","10.0.2.15","TCP","1494","443  >  45190 [ACK] Seq=71385 Ack=3782 Win=65535 Len=1440 [TCP segment of a reassembled PDU]"
"159","1.132442828","10.0.2.15","18.164.124.24","TCP","54","45190  >  443 [ACK] Seq=3782 Ack=72825 Win=65535 Len=0"
"160","1.132486283","18.164.124.24","10.0.2.15","TCP","1494","443  >  45190 [ACK] Seq=72825 Ack=3782 Win=65535 Len=1440 [TCP segment of a reassembled PDU]"
"161","1.132487989","10.0.2.15","18.164.124.24","TCP","54","45190  >  443 [ACK] Seq=3782 Ack=74265 Win=65535 Len=0"
"162","1.132518767","18.164.124.24","10.0.2.15","TCP","1494","443  >  45190 [ACK] Seq=74265 Ack=3782 Win=65535 Len=1440 [TCP segment of a reassembled PDU]"
"163","1.132520134","10.0.2.15","18.164.124.24","TCP","54","45190  >  443 [ACK] Seq=3782 Ack=75705 Win=65535 Len=0"
"164","1.132569879","18.164.124.24","10.0.2.15","TCP","1494","443  >  45190 [ACK] Seq=75705 Ack=3782 Win=65535 Len=1440 [TCP segment of a reassembled PDU]"
"165","1.132571552","10.0.2.15","18.164.124.24","TCP","54","45190  >  443 [ACK] Seq=3782 Ack=77145 Win=65535 Len=0"
"166","1.132618255","18.164.124.24","10.0.2.15","TCP","1494","443  >  45190 [ACK] Seq=77145 Ack=3782 Win=65535 Len=1440 [TCP segment of a reassembled PDU]"
"167","1.132619874","10.0.2.15","18.164.124.24","TCP","54","45190  >  443 [ACK] Seq=3782 Ack=78585 Win=65535 Len=0"
"168","1.132659140","18.164.124.24","10.0.2.15","TCP","1494","443  >  45190 [ACK] Seq=78585 Ack=3782 Win=65535 Len=1440 [TCP segment of a reassembled PDU]"
"169","1.132660420","10.0.2.15","18.164.124.24","TCP","54","45190  >  443 [ACK] Seq=3782 Ack=80025 Win=65535 Len=0"
"170","1.132711640","18.164.124.24","10.0.2.15","TCP","1494","443  >  45190 [ACK] Seq=80025 Ack=3782 Win=65535 Len=1440 [TCP segment of a reassembled PDU]"
"171","1.132713062","10.0.2.15","18.164.124.24","TCP","54","45190  >  443 [ACK] Seq=3782 Ack=81465 Win=65535 Len=0"
"172","1.132754811","18.164.124.24","10.0.2.15","TLSv1.2","1494","Application Data [TCP segment of a reassembled PDU]"
"173","1.132756102","10.0.2.15","18.164.124.24","TCP","54","45190  >  443 [ACK] Seq=3782 Ack=82905 Win=65535 Len=0"
"174","1.132794471","18.164.124.24","10.0.2.15","TCP","1494","443  >  45190 [ACK] Seq=82905 Ack=3782 Win=65535 Len=1440 [TCP segment of a reassembled PDU]"
"175","1.132795729","10.0.2.15","18.164.124.24","TCP","54","45190  >  443 [ACK] Seq=3782 Ack=84345 Win=65535 Len=0"
"176","1.132848207","18.164.124.24","10.0.2.15","TCP","1494","443  >  45190 [ACK] Seq=84345 Ack=3782 Win=65535 Len=1440 [TCP segment of a reassembled PDU]"
"177","1.132849487","10.0.2.15","18.164.124.24","TCP","54","45190  >  443 [ACK] Seq=3782 Ack=85785 Win=65535 Len=0"
"178","1.132886401","18.164.124.24","10.0.2.15","TLSv1.2","406","Application Data"
"179","1.132888118","10.0.2.15","18.164.124.24","TCP","54","45190  >  443 [ACK] Seq=3782 Ack=86137 Win=65535 Len=0"
"180","1.161372139","10.0.2.15","18.164.124.24","TLSv1.2","3792","Application Data"
"181","1.161485803","18.164.124.24","10.0.2.15","TCP","60","443  >  45190 [ACK] Seq=86137 Ack=5242 Win=65535 Len=0"
"182","1.161548355","18.164.124.24","10.0.2.15","TCP","60","443  >  45190 [ACK] Seq=86137 Ack=6702 Win=65535 Len=0"
"183","1.161548409","18.164.124.24","10.0.2.15","TCP","60","443  >  45190 [ACK] Seq=86137 Ack=7520 Win=65535 Len=0"
"184","1.167158490","18.164.124.24","10.0.2.15","TCP","2934","443  >  45190 [ACK] Seq=86137 Ack=7520 Win=65535 Len=2880 [TCP segment of a reassembled PDU]"
"185","1.167163915","10.0.2.15","18.164.124.24","TCP","54","45190  >  443 [ACK] Seq=7520 Ack=89017 Win=65535 Len=0"
"186","1.167195087","18.164.124.24","10.0.2.15","TCP","1494","443  >  45190 [ACK] Seq=89017 Ack=7520 Win=65535 Len=1440 [TCP segment of a reassembled PDU]"
"187","1.167222595","18.164.124.24","10.0.2.15","TCP","1494","443  >  45190 [ACK] Seq=90457 Ack=7520 Win=65535 Len=1440 [TCP segment of a reassembled PDU]"
"188","1.167223765","10.0.2.15","18.164.124.24","TCP","54","45190  >  443 [ACK] Seq=7520 Ack=91897 Win=65535 Len=0"
"189","1.167257321","18.164.124.24","10.0.2.15","TCP","1494","443  >  45190 [ACK] Seq=91897 Ack=7520 Win=65535 Len=1440 [TCP segment of a reassembled PDU]"
"190","1.167298250","18.164.124.24","10.0.2.15","TCP","1494","443  >  45190 [ACK] Seq=93337 Ack=7520 Win=65535 Len=1440 [TCP segment of a reassembled PDU]"
"191","1.167299300","10.0.2.15","18.164.124.24","TCP","54","45190  >  443 [ACK] Seq=7520 Ack=94777 Win=65535 Len=0"
"192","1.167337581","18.164.124.24","10.0.2.15","TCP","1494","443  >  45190 [ACK] Seq=94777 Ack=7520 Win=65535 Len=1440 [TCP segment of a reassembled PDU]"
"193","1.167380194","18.164.124.24","10.0.2.15","TCP","1494","443  >  45190 [ACK] Seq=96217 Ack=7520 Win=65535 Len=1440 [TCP segment of a reassembled PDU]"
"194","1.167381627","10.0.2.15","18.164.124.24","TCP","54","45190  >  443 [ACK] Seq=7520 Ack=97657 Win=65535 Len=0"
"195","1.167431841","18.164.124.24","10.0.2.15","TCP","2934","443  >  45190 [PSH, ACK] Seq=97657 Ack=7520 Win=65535 Len=2880 [TCP segment of a reassembled PDU]"
"196","1.167433395","10.0.2.15","18.164.124.24","TCP","54","45190  >  443 [ACK] Seq=7520 Ack=100537 Win=65535 Len=0"
"197","1.167763020","18.164.124.24","10.0.2.15","TLSv1.2","2934","Application Data [TCP segment of a reassembled PDU]"
"198","1.167786186","10.0.2.15","18.164.124.24","TCP","54","45190  >  443 [ACK] Seq=7520 Ack=103417 Win=65535 Len=0"
"199","1.167838063","18.164.124.24","10.0.2.15","TCP","2934","443  >  45190 [ACK] Seq=103417 Ack=7520 Win=65535 Len=2880 [TCP segment of a reassembled PDU]"
"200","1.167839660","10.0.2.15","18.164.124.24","TCP","54","45190  >  443 [ACK] Seq=7520 Ack=106297 Win=65535 Len=0"
"201","1.167896054","18.164.124.24","10.0.2.15","TCP","1494","443  >  45190 [ACK] Seq=106297 Ack=7520 Win=65535 Len=1440 [TCP segment of a reassembled PDU]"
"202","1.167934368","18.164.124.24","10.0.2.15","TCP","1494","443  >  45190 [ACK] Seq=107737 Ack=7520 Win=65535 Len=1440 [TCP segment of a reassembled PDU]"
"203","1.167937092","10.0.2.15","18.164.124.24","TCP","54","45190  >  443 [ACK] Seq=7520 Ack=109177 Win=65535 Len=0"
"204","1.167983773","18.164.124.24","10.0.2.15","TCP","2934","443  >  45190 [ACK] Seq=109177 Ack=7520 Win=65535 Len=2880 [TCP segment of a reassembled PDU]"
"205","1.167986387","10.0.2.15","18.164.124.24","TCP","54","45190  >  443 [ACK] Seq=7520 Ack=112057 Win=65535 Len=0"
"206","1.168028836","18.164.124.24","10.0.2.15","TCP","1494","443  >  45190 [ACK] Seq=112057 Ack=7520 Win=65535 Len=1440 [TCP segment of a reassembled PDU]"
"207","1.168052899","18.164.124.24","10.0.2.15","TCP","1494","443  >  45190 [ACK] Seq=113497 Ack=7520 Win=65535 Len=1440 [TCP segment of a reassembled PDU]"
"208","1.168053949","10.0.2.15","18.164.124.24","TCP","54","45190  >  443 [ACK] Seq=7520 Ack=114937 Win=65535 Len=0"
"209","1.168116063","18.164.124.24","10.0.2.15","TCP","2934","443  >  45190 [ACK] Seq=114937 Ack=7520 Win=65535 Len=2880 [TCP segment of a reassembled PDU]"
"210","1.168117365","10.0.2.15","18.164.124.24","TCP","54","45190  >  443 [ACK] Seq=7520 Ack=117817 Win=65535 Len=0"
"211","1.168163412","18.164.124.24","10.0.2.15","TLSv1.2","1494","Application Data [TCP segment of a reassembled PDU]"
"212","1.168207895","18.164.124.24","10.0.2.15","TCP","1494","443  >  45190 [ACK] Seq=119257 Ack=7520 Win=65535 Len=1440 [TCP segment of a reassembled PDU]"
"213","1.168209098","10.0.2.15","18.164.124.24","TCP","54","45190  >  443 [ACK] Seq=7520 Ack=120697 Win=65535 Len=0"
"214","1.168245006","18.164.124.24","10.0.2.15","TCP","1494","443  >  45190 [ACK] Seq=120697 Ack=7520 Win=65535 Len=1440 [TCP segment of a reassembled PDU]"
"215","1.168271519","18.164.124.24","10.0.2.15","TCP","1494","443  >  45190 [ACK] Seq=122137 Ack=7520 Win=65535 Len=1440 [TCP segment of a reassembled PDU]"
"216","1.168272821","10.0.2.15","18.164.124.24","TCP","54","45190  >  443 [ACK] Seq=7520 Ack=123577 Win=65535 Len=0"
"217","1.168314001","18.164.124.24","10.0.2.15","TCP","1494","443  >  45190 [ACK] Seq=123577 Ack=7520 Win=65535 Len=1440 [TCP segment of a reassembled PDU]"
"218","1.168340513","18.164.124.24","10.0.2.15","TCP","1494","443  >  45190 [ACK] Seq=125017 Ack=7520 Win=65535 Len=1440 [TCP segment of a reassembled PDU]"
"219","1.168341530","10.0.2.15","18.164.124.24","TCP","54","45190  >  443 [ACK] Seq=7520 Ack=126457 Win=65535 Len=0"
"220","1.168385346","18.164.124.24","10.0.2.15","TCP","1186","443  >  45190 [PSH, ACK] Seq=126457 Ack=7520 Win=65535 Len=1132 [TCP segment of a reassembled PDU]"
"221","1.168385412","18.164.124.24","10.0.2.15","TCP","1494","443  >  45190 [ACK] Seq=127589 Ack=7520 Win=65535 Len=1440 [TCP segment of a reassembled PDU]"
"222","1.168387282","10.0.2.15","18.164.124.24","TCP","54","45190  >  443 [ACK] Seq=7520 Ack=129029 Win=65535 Len=0"
"223","1.168430015","18.164.124.24","10.0.2.15","TCP","1494","443  >  45190 [ACK] Seq=129029 Ack=7520 Win=65535 Len=1440 [TCP segment of a reassembled PDU]"
"224","1.168482166","18.164.124.24","10.0.2.15","TCP","1494","443  >  45190 [ACK] Seq=130469 Ack=7520 Win=65535 Len=1440 [TCP segment of a reassembled PDU]"
"225","1.168483456","10.0.2.15","18.164.124.24","TCP","54","45190  >  443 [ACK] Seq=7520 Ack=131909 Win=65535 Len=0"
"226","1.168533726","18.164.124.24","10.0.2.15","TCP","1494","443  >  45190 [ACK] Seq=131909 Ack=7520 Win=65535 Len=1440 [TCP segment of a reassembled PDU]"
"227","1.168571624","18.164.124.24","10.0.2.15","TCP","1494","443  >  45190 [ACK] Seq=133349 Ack=7520 Win=65535 Len=1440 [TCP segment of a reassembled PDU]"
"228","1.168575048","10.0.2.15","18.164.124.24","TCP","54","45190  >  443 [ACK] Seq=7520 Ack=134789 Win=65535 Len=0"
"229","1.168623009","18.164.124.24","10.0.2.15","TLSv1.2","1494","Application Data [TCP segment of a reassembled PDU]"
"230","1.168651381","18.164.124.24","10.0.2.15","TCP","1494","443  >  45190 [ACK] Seq=136229 Ack=7520 Win=65535 Len=1440 [TCP segment of a reassembled PDU]"
"231","1.168652442","10.0.2.15","18.164.124.24","TCP","54","45190  >  443 [ACK] Seq=7520 Ack=137669 Win=65535 Len=0"
"232","1.168682870","18.164.124.24","10.0.2.15","TCP","2934","443  >  45190 [ACK] Seq=137669 Ack=7520 Win=65535 Len=2880 [TCP segment of a reassembled PDU]"
"233","1.168684413","10.0.2.15","18.164.124.24","TCP","54","45190  >  443 [ACK] Seq=7520 Ack=140549 Win=65535 Len=0"
"234","1.168771541","18.164.124.24","10.0.2.15","TCP","2934","443  >  45190 [ACK] Seq=140549 Ack=7520 Win=65535 Len=2880 [TCP segment of a reassembled PDU]"
"235","1.168775730","10.0.2.15","18.164.124.24","TCP","54","45190  >  443 [ACK] Seq=7520 Ack=143429 Win=65535 Len=0"
"236","1.168845654","18.164.124.24","10.0.2.15","TCP","2934","443  >  45190 [ACK] Seq=143429 Ack=7520 Win=65535 Len=2880 [TCP segment of a reassembled PDU]"
"237","1.168847700","10.0.2.15","18.164.124.24","TCP","54","45190  >  443 [ACK] Seq=7520 Ack=146309 Win=65535 Len=0"
"238","1.168886353","18.164.124.24","10.0.2.15","TCP","1494","443  >  45190 [ACK] Seq=146309 Ack=7520 Win=65535 Len=1440 [TCP segment of a reassembled PDU]"
"239","1.168916377","18.164.124.24","10.0.2.15","TCP","1494","443  >  45190 [ACK] Seq=147749 Ack=7520 Win=65535 Len=1440 [TCP segment of a reassembled PDU]"
"240","1.168917514","10.0.2.15","18.164.124.24","TCP","54","45190  >  443 [ACK] Seq=7520 Ack=149189 Win=65535 Len=0"
"241","1.168960203","18.164.124.24","10.0.2.15","TCP","1494","443  >  45190 [ACK] Seq=149189 Ack=7520 Win=65535 Len=1440 [TCP segment of a reassembled PDU]"
"242","1.168990971","18.164.124.24","10.0.2.15","TLSv1.2","1186","Application Data"
"243","1.168992141","10.0.2.15","18.164.124.24","TCP","54","45190  >  443 [ACK] Seq=7520 Ack=151761 Win=65535 Len=0"
"244","1.169052615","18.164.124.24","10.0.2.15","TCP","1494","443  >  45190 [ACK] Seq=151761 Ack=7520 Win=65535 Len=1440 [TCP segment of a reassembled PDU]"
"245","1.169086861","18.164.124.24","10.0.2.15","TCP","1494","443  >  45190 [ACK] Seq=153201 Ack=7520 Win=65535 Len=1440 [TCP segment of a reassembled PDU]"
"246","1.169090032","10.0.2.15","18.164.124.24","TCP","54","45190  >  443 [ACK] Seq=7520 Ack=154641 Win=65535 Len=0"
"247","1.169135380","18.164.124.24","10.0.2.15","TCP","2934","443  >  45190 [ACK] Seq=154641 Ack=7520 Win=65535 Len=2880 [TCP segment of a reassembled PDU]"
"248","1.169137097","10.0.2.15","18.164.124.24","TCP","54","45190  >  443 [ACK] Seq=7520 Ack=157521 Win=65535 Len=0"
"249","1.169198982","18.164.124.24","10.0.2.15","TCP","1494","443  >  45190 [ACK] Seq=157521 Ack=7520 Win=65535 Len=1440 [TCP segment of a reassembled PDU]"
"250","1.169233643","18.164.124.24","10.0.2.15","TCP","1494","443  >  45190 [ACK] Seq=158961 Ack=7520 Win=65535 Len=1440 [TCP segment of a reassembled PDU]"
"251","1.169234824","10.0.2.15","18.164.124.24","TCP","54","45190  >  443 [ACK] Seq=7520 Ack=160401 Win=65535 Len=0"
"252","1.169272493","18.164.124.24","10.0.2.15","TCP","1494","443  >  45190 [ACK] Seq=160401 Ack=7520 Win=65535 Len=1440 [TCP segment of a reassembled PDU]"
"253","1.169302090","18.164.124.24","10.0.2.15","TCP","1494","443  >  45190 [ACK] Seq=161841 Ack=7520 Win=65535 Len=1440 [TCP segment of a reassembled PDU]"
"254","1.169307800","10.0.2.15","18.164.124.24","TCP","54","45190  >  443 [ACK] Seq=7520 Ack=163281 Win=65535 Len=0"
"255","1.169337276","18.164.124.24","10.0.2.15","TCP","1494","443  >  45190 [ACK] Seq=163281 Ack=7520 Win=65535 Len=1440 [TCP segment of a reassembled PDU]"
"256","1.169376772","18.164.124.24","10.0.2.15","TCP","1494","443  >  45190 [ACK] Seq=164721 Ack=7520 Win=65535 Len=1440 [TCP segment of a reassembled PDU]"
"257","1.169378456","10.0.2.15","18.164.124.24","TCP","54","45190  >  443 [ACK] Seq=7520 Ack=166161 Win=65535 Len=0"
"258","1.169405571","18.164.124.24","10.0.2.15","TLSv1.2","4374","Application Data [TCP segment of a reassembled PDU]"
"259","1.169407353","10.0.2.15","18.164.124.24","TCP","54","45190  >  443 [ACK] Seq=7520 Ack=170481 Win=65535 Len=0"
"260","1.169449496","18.164.124.24","10.0.2.15","TCP","1494","443  >  45190 [ACK] Seq=170481 Ack=7520 Win=65535 Len=1440 [TCP segment of a reassembled PDU]"
"261","1.169520087","18.164.124.24","10.0.2.15","TLSv1.2","406","Application Data"
"262","1.169521564","10.0.2.15","18.164.124.24","TCP","54","45190  >  443 [ACK] Seq=7520 Ack=172273 Win=65535 Len=0"
"263","1.175807116","10.0.2.15","108.138.106.51","TLSv1.2","395","Application Data"
"264","1.175882256","108.138.106.51","10.0.2.15","TCP","60","443  >  55970 [ACK] Seq=1 Ack=342 Win=65535 Len=0"
"265","1.255548682","108.138.106.51","10.0.2.15","TLSv1.2","1444","Application Data, Application Data"
"266","1.255557913","10.0.2.15","108.138.106.51","TCP","54","55970  >  443 [ACK] Seq=342 Ack=1391 Win=63360 Len=0"
"267","1.294092695","23.204.12.188","10.0.2.15","TLSv1.2","388","Application Data"
"268","1.294104332","10.0.2.15","23.204.12.188","TCP","54","38456  >  443 [ACK] Seq=3705 Ack=335 Win=63360 Len=0"
"269","1.294260715","23.204.12.188","10.0.2.15","TCP","2934","443  >  38456 [ACK] Seq=335 Ack=3705 Win=65535 Len=2880 [TCP segment of a reassembled PDU]"
"270","1.294265561","10.0.2.15","23.204.12.188","TCP","54","38456  >  443 [ACK] Seq=3705 Ack=3215 Win=63360 Len=0"
"271","1.294301600","23.204.12.188","10.0.2.15","TCP","1494","443  >  38456 [ACK] Seq=3215 Ack=3705 Win=65535 Len=1440 [TCP segment of a reassembled PDU]"
"272","1.294303131","10.0.2.15","23.204.12.188","TCP","54","38456  >  443 [ACK] Seq=3705 Ack=4655 Win=63360 Len=0"
"273","1.294330803","23.204.12.188","10.0.2.15","TCP","1494","443  >  38456 [ACK] Seq=4655 Ack=3705 Win=65535 Len=1440 [TCP segment of a reassembled PDU]"
"274","1.294332083","10.0.2.15","23.204.12.188","TCP","54","38456  >  443 [ACK] Seq=3705 Ack=6095 Win=63360 Len=0"
"275","1.294377080","23.204.12.188","10.0.2.15","TCP","134","443  >  38456 [PSH, ACK] Seq=6095 Ack=3705 Win=65535 Len=80 [TCP segment of a reassembled PDU]"
"276","1.294380460","10.0.2.15","23.204.12.188","TCP","54","38456  >  443 [ACK] Seq=3705 Ack=6175 Win=63360 Len=0"
"277","1.295303132","23.204.12.188","10.0.2.15","TCP","1494","443  >  38456 [ACK] Seq=6175 Ack=3705 Win=65535 Len=1440 [TCP segment of a reassembled PDU]"
"278","1.295309093","10.0.2.15","23.204.12.188","TCP","54","38456  >  443 [ACK] Seq=3705 Ack=7615 Win=63360 Len=0"
"279","1.295347943","23.204.12.188","10.0.2.15","TCP","4454","443  >  38456 [PSH, ACK] Seq=7615 Ack=3705 Win=65535 Len=4400 [TCP segment of a reassembled PDU]"
"280","1.295353576","10.0.2.15","23.204.12.188","TCP","54","38456  >  443 [ACK] Seq=3705 Ack=12015 Win=58960 Len=0"
"281","1.296195108","23.204.12.188","10.0.2.15","TCP","1514","443  >  38456 [PSH, ACK] Seq=12015 Ack=3705 Win=65535 Len=1460 [TCP segment of a reassembled PDU]"
"282","1.296199800","10.0.2.15","23.204.12.188","TCP","54","38456  >  443 [ACK] Seq=3705 Ack=13475 Win=63360 Len=0"
"283","1.296303215","23.204.12.188","10.0.2.15","TLSv1.2","1179","Application Data"
"284","1.296306846","10.0.2.15","23.204.12.188","TCP","54","38456  >  443 [ACK] Seq=3705 Ack=14600 Win=63360 Len=0"
"285","1.297930190","10.0.2.15","13.249.91.50","TCP","74","36182  >  443 [SYN] Seq=0 Win=64240 Len=0 MSS=1460 SACK_PERM=1 TSval=3331502014 TSecr=0 WS=128"
"286","1.305688350","13.249.91.50","10.0.2.15","TCP","60","443  >  36182 [SYN, ACK] Seq=0 Ack=1 Win=65535 Len=0 MSS=1460"
"287","1.305704254","10.0.2.15","13.249.91.50","TCP","54","36182  >  443 [ACK] Seq=1 Ack=1 Win=64240 Len=0"
"288","1.306852384","10.0.2.15","13.249.91.50","TLSv1.3","615","Client Hello"
"289","1.306969491","13.249.91.50","10.0.2.15","TCP","60","443  >  36182 [ACK] Seq=1 Ack=562 Win=65535 Len=0"
"290","1.317110320","13.249.91.50","10.0.2.15","TLSv1.3","279","Server Hello, Change Cipher Spec, Application Data, Application Data"
"291","1.317115866","10.0.2.15","13.249.91.50","TCP","54","36182  >  443 [ACK] Seq=562 Ack=226 Win=64015 Len=0"
"292","1.317512265","10.0.2.15","13.249.91.50","TLSv1.3","118","Change Cipher Spec, Application Data"
"293","1.317598311","13.249.91.50","10.0.2.15","TCP","60","443  >  36182 [ACK] Seq=226 Ack=626 Win=65535 Len=0"
"294","1.324484656","13.249.91.50","10.0.2.15","TLSv1.3","233","Application Data"
"295","1.324489709","10.0.2.15","13.249.91.50","TCP","54","36182  >  443 [ACK] Seq=626 Ack=405 Win=64015 Len=0"
"296","1.499449072","10.0.2.15","23.204.152.207","TCP","74","41664  >  443 [SYN] Seq=0 Win=64240 Len=0 MSS=1460 SACK_PERM=1 TSval=221501009 TSecr=0 WS=128"
"297","1.506979662","23.204.152.207","10.0.2.15","TCP","60","443  >  41664 [SYN, ACK] Seq=0 Ack=1 Win=65535 Len=0 MSS=1460"
"298","1.507007476","10.0.2.15","23.204.152.207","TCP","54","41664  >  443 [ACK] Seq=1 Ack=1 Win=64240 Len=0"
"299","1.508171866","10.0.2.15","23.204.152.207","TLSv1.3","737","Client Hello"
"300","1.508280971","23.204.152.207","10.0.2.15","TCP","60","443  >  41664 [ACK] Seq=1 Ack=684 Win=65535 Len=0"
"301","1.521297166","23.204.152.207","10.0.2.15","TLSv1.3","318","Server Hello, Change Cipher Spec, Application Data, Application Data"
"302","1.521303455","10.0.2.15","23.204.152.207","TCP","54","41664  >  443 [ACK] Seq=684 Ack=265 Win=63976 Len=0"
"303","1.521728468","10.0.2.15","23.204.152.207","TLSv1.3","134","Change Cipher Spec, Application Data"
"304","1.521912812","23.204.152.207","10.0.2.15","TCP","60","443  >  41664 [ACK] Seq=265 Ack=764 Win=65535 Len=0"
"305","1.522433777","10.0.2.15","23.204.152.207","TLSv1.3","224","Application Data"
"306","1.522604217","23.204.152.207","10.0.2.15","TCP","60","443  >  41664 [ACK] Seq=265 Ack=934 Win=65535 Len=0"
"307","1.524231160","10.0.2.15","13.248.140.122","TLSv1.2","152","Application Data"
"308","1.524330955","13.248.140.122","10.0.2.15","TCP","60","443  >  53906 [ACK] Seq=1 Ack=99 Win=65535 Len=0"
"309","1.529136132","23.204.152.207","10.0.2.15","TLSv1.3","341","Application Data"
"310","1.529141743","10.0.2.15","23.204.152.207","TCP","54","41664  >  443 [ACK] Seq=934 Ack=552 Win=63976 Len=0"
"311","1.530189913","23.204.152.207","10.0.2.15","TLSv1.3","115","Application Data"
"312","1.530194605","10.0.2.15","23.204.152.207","TCP","54","41664  >  443 [ACK] Seq=934 Ack=613 Win=63976 Len=0"
"313","1.530244894","10.0.2.15","23.204.152.207","TLSv1.3","85","Application Data"
"314","1.530265645","23.204.152.207","10.0.2.15","TLSv1.3","85","Application Data"
"315","1.530267023","10.0.2.15","23.204.152.207","TCP","54","41664  >  443 [ACK] Seq=965 Ack=644 Win=63976 Len=0"
"316","1.530353452","23.204.152.207","10.0.2.15","TCP","60","443  >  41664 [ACK] Seq=644 Ack=965 Win=65535 Len=0"
"317","1.536809768","13.248.140.122","10.0.2.15","TLSv1.2","267","Application Data"
"318","1.536815510","10.0.2.15","13.248.140.122","TCP","54","53906  >  443 [ACK] Seq=99 Ack=214 Win=63360 Len=0"
"319","1.538343943","10.0.2.15","13.248.140.122","TLSv1.2","3795","Application Data"
