"No.","Time","Source","Destination","Protocol","Length","Info"
"1","0.000000000","10.0.2.15","34.206.214.13","TLSv1.2","701","Application Data"
"2","0.000193757","34.206.214.13","10.0.2.15","TCP","60","443  >  49560 [ACK] Seq=1 Ack=648 Win=65535 Len=0"
"3","0.012107787","10.0.2.15","18.173.240.180","TCP","54","60990  >  80 [FIN, ACK] Seq=1 Ack=1 Win=63170 Len=0"
"4","0.012231731","18.173.240.180","10.0.2.15","TCP","60","80  >  60990 [ACK] Seq=1 Ack=2 Win=65535 Len=0"
"5","0.016715738","34.206.214.13","10.0.2.15","TLSv1.2","275","Application Data, Application Data"
"6","0.016721524","10.0.2.15","34.206.214.13","TCP","54","49560  >  443 [ACK] Seq=648 Ack=222 Win=63360 Len=0"
"7","0.018759414","18.173.240.180","10.0.2.15","TCP","60","80  >  60990 [FIN, ACK] Seq=1 Ack=2 Win=65535 Len=0"
"8","0.018771204","10.0.2.15","18.173.240.180","TCP","54","60990  >  80 [ACK] Seq=2 Ack=2 Win=63170 Len=0"
"9","0.573291168","10.0.2.15","34.206.214.13","TLSv1.2","701","Application Data"
"10","0.573481794","34.206.214.13","10.0.2.15","TCP","60","443  >  49560 [ACK] Seq=222 Ack=1295 Win=65535 Len=0"
"11","0.591544338","34.206.214.13","10.0.2.15","TLSv1.2","244","Application Data"
"12","0.591552519","10.0.2.15","34.206.214.13","TCP","54","49560  >  443 [ACK] Seq=1295 Ack=412 Win=63360 Len=0"
"13","0.591590746","34.206.214.13","10.0.2.15","TLSv1.2","85","Application Data"
"14","0.591592770","10.0.2.15","34.206.214.13","TCP","54","49560  >  443 [ACK] Seq=1295 Ack=443 Win=63360 Len=0"
"15","0.592590284","10.0.2.15","34.120.63.153","TLSv1.2","93","Application Data"
"16","0.592610355","10.0.2.15","3.218.122.15","TLSv1.2","93","Application Data"
"17","0.592620734","10.0.2.15","207.65.37.179","TLSv1.2","93","Application Data"
"18","0.592630348","10.0.2.15","34.107.165.188","TLSv1.2","93","Application Data"
"19","0.592641789","10.0.2.15","108.138.106.108","TLSv1.2","93","Application Data"
"20","0.592653547","10.0.2.15","52.0.96.241","TLSv1.2","93","Application Data"
"21","0.592673971","34.120.63.153","10.0.2.15","TCP","60","443  >  33458 [ACK] Seq=1 Ack=40 Win=65535 Len=0"
"22","0.592676888","10.0.2.15","18.164.116.58","TLSv1.2","93","Application Data"
"23","0.592703513","3.218.122.15","10.0.2.15","TCP","60","443  >  54574 [ACK] Seq=1 Ack=40 Win=65535 Len=0"
"24","0.592730562","207.65.37.179","10.0.2.15","TCP","60","443  >  51454 [ACK] Seq=1 Ack=40 Win=65535 Len=0"
"25","0.592752929","34.107.165.188","10.0.2.15","TCP","60","443  >  52958 [ACK] Seq=1 Ack=40 Win=65535 Len=0"
"26","0.592822815","108.138.106.108","10.0.2.15","TCP","60","443  >  37264 [ACK] Seq=1 Ack=40 Win=65535 Len=0"
"27","0.592846517","52.0.96.241","10.0.2.15","TCP","60","443  >  40338 [ACK] Seq=1 Ack=40 Win=65535 Len=0"
"28","0.592846571","18.164.116.58","10.0.2.15","TCP","60","443  >  52674 [ACK] Seq=1 Ack=40 Win=65535 Len=0"
"29","0.598628361","18.164.116.58","10.0.2.15","TLSv1.2","93","Application Data"
"30","0.598633589","10.0.2.15","18.164.116.58","TCP","54","52674  >  443 [ACK] Seq=40 Ack=40 Win=63360 Len=0"
"31","0.599123789","108.138.106.108","10.0.2.15","TLSv1.2","93","Application Data"
"32","0.599128788","10.0.2.15","108.138.106.108","TCP","54","37264  >  443 [ACK] Seq=40 Ack=40 Win=63360 Len=0"
"33","0.599476679","207.65.37.179","10.0.2.15","TLSv1.2","93","Application Data"
"34","0.599480453","10.0.2.15","207.65.37.179","TCP","54","51454  >  443 [ACK] Seq=40 Ack=40 Win=63360 Len=0"
"35","0.599755095","34.120.63.153","10.0.2.15","TLSv1.2","93","Application Data"
"36","0.599758825","10.0.2.15","34.120.63.153","TCP","54","33458  >  443 [ACK] Seq=40 Ack=40 Win=63360 Len=0"
"37","0.599920450","34.107.165.188","10.0.2.15","TLSv1.2","93","Application Data"
"38","0.599921937","10.0.2.15","34.107.165.188","TCP","54","52958  >  443 [ACK] Seq=40 Ack=40 Win=63360 Len=0"
"39","0.604861270","10.0.2.15","50.17.170.53","TLSv1.2","800","Application Data"
"40","0.604951172","50.17.170.53","10.0.2.15","TCP","60","443  >  49996 [ACK] Seq=1 Ack=747 Win=65535 Len=0"
"41","0.605014544","52.0.96.241","10.0.2.15","TLSv1.2","93","Application Data"
"42","0.605017815","10.0.2.15","52.0.96.241","TCP","54","40338  >  443 [ACK] Seq=40 Ack=40 Win=63360 Len=0"
"43","0.606325407","3.218.122.15","10.0.2.15","TLSv1.2","93","Application Data"
"44","0.606330187","10.0.2.15","3.218.122.15","TCP","54","54574  >  443 [ACK] Seq=40 Ack=40 Win=63360 Len=0"
"45","0.618700711","50.17.170.53","10.0.2.15","TLSv1.2","342","Application Data"
"46","0.618706092","10.0.2.15","50.17.170.53","TCP","54","49996  >  443 [ACK] Seq=747 Ack=289 Win=63360 Len=0"
"47","1.012553683","10.0.2.15","18.173.240.180","TCP","54","60992  >  80 [FIN, ACK] Seq=1 Ack=1 Win=63189 Len=0"
"48","1.012592752","10.0.2.15","18.173.240.180","TCP","54","60994  >  80 [FIN, ACK] Seq=1 Ack=1 Win=63170 Len=0"
"49","1.012738200","18.173.240.180","10.0.2.15","TCP","60","80  >  60992 [ACK] Seq=1 Ack=2 Win=65535 Len=0"
"50","1.012738287","18.173.240.180","10.0.2.15","TCP","60","80  >  60994 [ACK] Seq=1 Ack=2 Win=65535 Len=0"
"51","1.018743907","18.173.240.180","10.0.2.15","TCP","60","80  >  60992 [FIN, ACK] Seq=1 Ack=2 Win=65535 Len=0"
"52","1.018760084","10.0.2.15","18.173.240.180","TCP","54","60992  >  80 [ACK] Seq=2 Ack=2 Win=63189 Len=0"
"53","1.019069858","18.173.240.180","10.0.2.15","TCP","60","80  >  60994 [FIN, ACK] Seq=1 Ack=2 Win=65535 Len=0"
"54","1.019075108","10.0.2.15","18.173.240.180","TCP","54","60994  >  80 [ACK] Seq=2 Ack=2 Win=63170 Len=0"
"55","1.066227035","10.0.2.15","99.83.181.31","TLSv1.2","133","Application Data"
"56","1.066244929","10.0.2.15","99.83.181.31","TLSv1.2","438","Application Data"
"57","1.066345573","99.83.181.31","10.0.2.15","TCP","60","443  >  40876 [ACK] Seq=1 Ack=80 Win=65535 Len=0"
"58","1.066375563","99.83.181.31","10.0.2.15","TCP","60","443  >  40876 [ACK] Seq=1 Ack=464 Win=65535 Len=0"
"59","1.084195605","10.0.2.15","104.109.53.145","TCP","74","52476  >  443 [SYN] Seq=0 Win=64240 Len=0 MSS=1460 SACK_PERM=1 TSval=2380830614 TSecr=0 WS=128"
"60","1.091179396","104.109.53.145","10.0.2.15","TCP","60","443  >  52476 [SYN, ACK] Seq=0 Ack=1 Win=65535 Len=0 MSS=1460"
"61","1.091196109","10.0.2.15","104.109.53.145","TCP","54","52476  >  443 [ACK] Seq=1 Ack=1 Win=64240 Len=0"
"62","1.092172587","10.0.2.15","104.109.53.145","TLSv1.3","571","Client Hello"
"63","1.092260991","104.109.53.145","10.0.2.15","TCP","60","443  >  52476 [ACK] Seq=1 Ack=518 Win=65535 Len=0"
"64","1.096229188","99.83.181.31","10.0.2.15","TLSv1.2","155","Application Data"
"65","1.096234963","10.0.2.15","99.83.181.31","TCP","54","40876  >  443 [ACK] Seq=464 Ack=102 Win=63360 Len=0"
"66","1.103816575","104.109.53.145","10.0.2.15","TLSv1.3","1514","Server Hello, Change Cipher Spec, Application Data"
"67","1.103821814","10.0.2.15","104.109.53.145","TCP","54","52476  >  443 [ACK] Seq=518 Ack=1461 Win=63360 Len=0"
"68","1.104233832","104.109.53.145","10.0.2.15","TCP","1494","443  >  52476 [ACK] Seq=1461 Ack=518 Win=65535 Len=1440 [TCP segment of a reassembled PDU]"
"69","1.104237376","10.0.2.15","104.109.53.145","TCP","54","52476  >  443 [ACK] Seq=518 Ack=2901 Win=63360 Len=0"
"70","1.104283500","104.109.53.145","10.0.2.15","TCP","74","443  >  52476 [PSH, ACK] Seq=2901 Ack=518 Win=65535 Len=20 [TCP segment of a reassembled PDU]"
"71","1.104284889","10.0.2.15","104.109.53.145","TCP","54","52476  >  443 [ACK] Seq=518 Ack=2921 Win=63360 Len=0"
"72","1.104544175","104.109.53.145","10.0.2.15","TLSv1.3","786","Application Data, Application Data, Application Data"
"73","1.104546713","10.0.2.15","104.109.53.145","TCP","54","52476  >  443 [ACK] Seq=518 Ack=3653 Win=63360 Len=0"
"74","1.106596743","10.0.2.15","104.109.53.145","TLSv1.3","134","Change Cipher Spec, Application Data"
"75","1.106697347","104.109.53.145","10.0.2.15","TCP","60","443  >  52476 [ACK] Seq=3653 Ack=598 Win=65535 Len=0"
"76","1.106858873","10.0.2.15","104.109.53.145","TLSv1.3","224","Application Data"
"77","1.106871298","10.0.2.15","104.109.53.145","TLSv1.3","3777","Application Data"
"78","1.106925658","104.109.53.145","10.0.2.15","TCP","60","443  >  52476 [ACK] Seq=3653 Ack=768 Win=65535 Len=0"
"79","1.106989940","104.109.53.145","10.0.2.15","TCP","60","443  >  52476 [ACK] Seq=3653 Ack=2228 Win=65535 Len=0"
"80","1.107023540","104.109.53.145","10.0.2.15","TCP","60","443  >  52476 [ACK] Seq=3653 Ack=3688 Win=65535 Len=0"
"81","1.107023584","104.109.53.145","10.0.2.15","TCP","60","443  >  52476 [ACK] Seq=3653 Ack=4491 Win=65535 Len=0"
"82","1.112022558","104.109.53.145","10.0.2.15","TLSv1.3","628","Application Data, Application Data"
"83","1.112027491","10.0.2.15","104.109.53.145","TCP","54","52476  >  443 [ACK] Seq=4491 Ack=4227 Win=63360 Len=0"
"84","1.114253837","104.109.53.145","10.0.2.15","TLSv1.3","115","Application Data"
"85","1.114258813","10.0.2.15","104.109.53.145","TCP","54","52476  >  443 [ACK] Seq=4491 Ack=4288 Win=63360 Len=0"
"86","1.114311513","10.0.2.15","104.109.53.145","TLSv1.3","85","Application Data"
"87","1.114341401","104.109.53.145","10.0.2.15","TLSv1.3","85","Application Data"
"88","1.114345907","10.0.2.15","104.109.53.145","TCP","54","52476  >  443 [ACK] Seq=4522 Ack=4319 Win=63360 Len=0"
"89","1.114388881","104.109.53.145","10.0.2.15","TCP","60","443  >  52476 [ACK] Seq=4319 Ack=4522 Win=65535 Len=0"
"90","1.132572116","104.109.53.145","10.0.2.15","TLSv1.3","922","Application Data"
"91","1.132577191","10.0.2.15","104.109.53.145","TCP","54","52476  >  443 [ACK] Seq=4522 Ack=5187 Win=63360 Len=0"
"92","1.132631901","104.109.53.145","10.0.2.15","TCP","1494","443  >  52476 [ACK] Seq=5187 Ack=4522 Win=65535 Len=1440 [TCP segment of a reassembled PDU]"
"93","1.132635499","10.0.2.15","104.109.53.145","TCP","54","52476  >  443 [ACK] Seq=4522 Ack=6627 Win=63360 Len=0"
"94","1.132668924","104.109.53.145","10.0.2.15","TCP","74","443  >  52476 [PSH, ACK] Seq=6627 Ack=4522 Win=65535 Len=20 [TCP segment of a reassembled PDU]"
"95","1.132670510","10.0.2.15","104.109.53.145","TCP","54","52476  >  443 [ACK] Seq=4522 Ack=6647 Win=63360 Len=0"
"96","1.132874328","104.109.53.145","10.0.2.15","TCP","4374","443  >  52476 [ACK] Seq=6647 Ack=4522 Win=65535 Len=4320 [TCP segment of a reassembled PDU]"
"97","1.132912665","104.109.53.145","10.0.2.15","TCP","1494","443  >  52476 [ACK] Seq=10967 Ack=4522 Win=65535 Len=1440 [TCP segment of a reassembled PDU]"
"98","1.132922528","10.0.2.15","104.109.53.145","TCP","54","52476  >  443 [ACK] Seq=4522 Ack=12407 Win=63360 Len=0"
"99","1.132938040","104.109.53.145","10.0.2.15","TCP","1494","443  >  52476 [ACK] Seq=12407 Ack=4522 Win=65535 Len=1440 [TCP segment of a reassembled PDU]"
"100","1.132960702","104.109.53.145","10.0.2.15","TCP","1494","443  >  52476 [ACK] Seq=13847 Ack=4522 Win=65535 Len=1440 [TCP segment of a reassembled PDU]"
"101","1.132963634","10.0.2.15","104.109.53.145","TCP","54","52476  >  443 [ACK] Seq=4522 Ack=15287 Win=63360 Len=0"
"102","1.133001259","104.109.53.145","10.0.2.15","TCP","174","443  >  52476 [PSH, ACK] Seq=15287 Ack=4522 Win=65535 Len=120 [TCP segment of a reassembled PDU]"
"103","1.133068954","10.0.2.15","104.109.53.145","TCP","54","52476  >  443 [ACK] Seq=4522 Ack=15407 Win=63360 Len=0"
"104","1.133185371","104.109.53.145","10.0.2.15","TCP","2934","443  >  52476 [ACK] Seq=15407 Ack=4522 Win=65535 Len=2880 [TCP segment of a reassembled PDU]"
"105","1.133190545","10.0.2.15","104.109.53.145","TCP","54","52476  >  443 [ACK] Seq=4522 Ack=18287 Win=63360 Len=0"
"106","1.133226464","104.109.53.145","10.0.2.15","TCP","1494","443  >  52476 [ACK] Seq=18287 Ack=4522 Win=65535 Len=1440 [TCP segment of a reassembled PDU]"
"107","1.133276146","104.109.53.145","10.0.2.15","TLSv1.3","1951","Application Data, Application Data"
"108","1.133280947","10.0.2.15","104.109.53.145","TCP","54","52476  >  443 [ACK] Seq=4522 Ack=21624 Win=63360 Len=0"
"109","1.133318835","104.109.53.145","10.0.2.15","TCP","1494","443  >  52476 [ACK] Seq=21624 Ack=4522 Win=65535 Len=1440 [TCP segment of a reassembled PDU]"
"110","1.133367020","104.109.53.145","10.0.2.15","TCP","1534","443  >  52476 [PSH, ACK] Seq=23064 Ack=4522 Win=65535 Len=1480 [TCP segment of a reassembled PDU]"
"111","1.133371811","10.0.2.15","104.109.53.145","TCP","54","52476  >  443 [ACK] Seq=4522 Ack=24544 Win=63360 Len=0"
"112","1.137663574","104.109.53.145","10.0.2.15","TCP","1514","443  >  52476 [PSH, ACK] Seq=24544 Ack=4522 Win=65535 Len=1460 [TCP segment of a reassembled PDU]"
"113","1.137668409","10.0.2.15","104.109.53.145","TCP","54","52476  >  443 [ACK] Seq=4522 Ack=26004 Win=63360 Len=0"
"114","1.137751928","104.109.53.145","10.0.2.15","TCP","1514","443  >  52476 [PSH, ACK] Seq=26004 Ack=4522 Win=65535 Len=1460 [TCP segment of a reassembled PDU]"
"115","1.137801029","10.0.2.15","104.109.53.145","TCP","54","52476  >  443 [ACK] Seq=4522 Ack=27464 Win=63360 Len=0"
"116","1.137968645","104.109.53.145","10.0.2.15","TCP","1494","443  >  52476 [ACK] Seq=27464 Ack=4522 Win=65535 Len=1440 [TCP segment of a reassembled PDU]"
"117","1.138000156","104.109.53.145","10.0.2.15","TCP","4454","443  >  52476 [PSH, ACK] Seq=28904 Ack=4522 Win=65535 Len=4400 [TCP segment of a reassembled PDU]"
"118","1.138070093","10.0.2.15","104.109.53.145","TCP","54","52476  >  443 [ACK] Seq=4522 Ack=33304 Win=63360 Len=0"
"119","1.138152200","104.109.53.145","10.0.2.15","TCP","1494","443  >  52476 [ACK] Seq=33304 Ack=4522 Win=65535 Len=1440 [TCP segment of a reassembled PDU]"
"120","1.138186051","104.109.53.145","10.0.2.15","TLSv1.3","4454","Application Data, Application Data"
"121","1.138725418","10.0.2.15","104.109.53.145","TCP","54","52476  >  443 [ACK] Seq=4522 Ack=39144 Win=60480 Len=0"
"122","1.138732296","104.109.53.145","10.0.2.15","TCP","1514","443  >  52476 [PSH, ACK] Seq=39144 Ack=4522 Win=65535 Len=1460 [TCP segment of a reassembled PDU]"
"123","1.138745456","10.0.2.15","104.109.53.145","TCP","54","52476  >  443 [ACK] Seq=4522 Ack=40604 Win=59040 Len=0"
"124","1.139796555","104.109.53.145","10.0.2.15","TCP","1494","443  >  52476 [ACK] Seq=40604 Ack=4522 Win=65535 Len=1440 [TCP segment of a reassembled PDU]"
"125","1.139871434","104.109.53.145","10.0.2.15","TCP","74","443  >  52476 [PSH, ACK] Seq=42044 Ack=4522 Win=65535 Len=20 [TCP segment of a reassembled PDU]"
"126","1.139871488","104.109.53.145","10.0.2.15","TCP","1514","443  >  52476 [PSH, ACK] Seq=42064 Ack=4522 Win=65535 Len=1460 [TCP segment of a reassembled PDU]"
"127","1.139875229","10.0.2.15","104.109.53.145","TCP","54","52476  >  443 [ACK] Seq=4522 Ack=42064 Win=63360 Len=0"
"128","1.139880687","10.0.2.15","104.109.53.145","TCP","54","52476  >  443 [ACK] Seq=4522 Ack=43524 Win=63360 Len=0"
"129","1.140085799","104.109.53.145","10.0.2.15","TCP","1494","443  >  52476 [ACK] Seq=43524 Ack=4522 Win=65535 Len=1440 [TCP segment of a reassembled PDU]"
"130","1.140122911","104.109.53.145","10.0.2.15","TCP","5814","443  >  52476 [ACK] Seq=44964 Ack=4522 Win=65535 Len=5760 [TCP segment of a reassembled PDU]"
"131","1.140146240","104.109.53.145","10.0.2.15","TCP","154","443  >  52476 [PSH, ACK] Seq=50724 Ack=4522 Win=65535 Len=100 [TCP segment of a reassembled PDU]"
"132","1.140199736","10.0.2.15","104.109.53.145","TCP","54","52476  >  443 [ACK] Seq=4522 Ack=50824 Win=63360 Len=0"
"133","1.140296501","104.109.53.145","10.0.2.15","TCP","2974","443  >  52476 [PSH, ACK] Seq=50824 Ack=4522 Win=65535 Len=2920 [TCP segment of a reassembled PDU]"
"134","1.140353059","10.0.2.15","104.109.53.145","TCP","54","52476  >  443 [ACK] Seq=4522 Ack=53744 Win=63360 Len=0"
"135","1.140367475","104.109.53.145","10.0.2.15","TLSv1.3","2934","Application Data, Application Data"
"136","1.140371620","10.0.2.15","104.109.53.145","TCP","54","52476  >  443 [ACK] Seq=4522 Ack=56624 Win=63360 Len=0"
"137","1.140433746","104.109.53.145","10.0.2.15","TCP","94","443  >  52476 [PSH, ACK] Seq=56624 Ack=4522 Win=65535 Len=40 [TCP segment of a reassembled PDU]"
"138","1.140433789","104.109.53.145","10.0.2.15","TCP","1494","443  >  52476 [ACK] Seq=56664 Ack=4522 Win=65535 Len=1440 [TCP segment of a reassembled PDU]"
"139","1.140451891","10.0.2.15","104.109.53.145","TCP","54","52476  >  443 [ACK] Seq=4522 Ack=58104 Win=61920 Len=0"
"140","1.140465629","104.109.53.145","10.0.2.15","TCP","1494","443  >  52476 [ACK] Seq=58104 Ack=4522 Win=65535 Len=1440 [TCP segment of a reassembled PDU]"
"141","1.140498354","104.109.53.145","10.0.2.15","TCP","94","443  >  52476 [PSH, ACK] Seq=59544 Ack=4522 Win=65535 Len=40 [TCP segment of a reassembled PDU]"
"142","1.140499513","10.0.2.15","104.109.53.145","TCP","54","52476  >  443 [ACK] Seq=4522 Ack=59584 Win=63360 Len=0"
"143","1.140529657","104.109.53.145","10.0.2.15","TCP","1494","443  >  52476 [ACK] Seq=59584 Ack=4522 Win=65535 Len=1440 [TCP segment of a reassembled PDU]"
"144","1.140561387","104.109.53.145","10.0.2.15","TCP","74","443  >  52476 [PSH, ACK] Seq=61024 Ack=4522 Win=65535 Len=20 [TCP segment of a reassembled PDU]"
"145","1.140562623","10.0.2.15","104.109.53.145","TCP","54","52476  >  443 [ACK] Seq=4522 Ack=61044 Win=63360 Len=0"
"146","1.141549335","104.109.53.145","10.0.2.15","TCP","1494","443  >  52476 [ACK] Seq=61044 Ack=4522 Win=65535 Len=1440 [TCP segment of a reassembled PDU]"
"147","1.141606210","104.109.53.145","10.0.2.15","TCP","2934","443  >  52476 [ACK] Seq=62484 Ack=4522 Win=65535 Len=2880 [TCP segment of a reassembled PDU]"
"148","1.141608584","10.0.2.15","104.109.53.145","TCP","54","52476  >  443 [ACK] Seq=4522 Ack=65364 Win=63360 Len=0"
"149","1.141666246","104.109.53.145","10.0.2.15","TCP","2934","443  >  52476 [ACK] Seq=65364 Ack=4522 Win=65535 Len=2880 [TCP segment of a reassembled PDU]"
"150","1.141667428","10.0.2.15","104.109.53.145","TCP","54","52476  >  443 [ACK] Seq=4522 Ack=68244 Win=63360 Len=0"
"151","1.141707590","104.109.53.145","10.0.2.15","TCP","1494","443  >  52476 [ACK] Seq=68244 Ack=4522 Win=65535 Len=1440 [TCP segment of a reassembled PDU]"
"152","1.141708859","10.0.2.15","104.109.53.145","TCP","54","52476  >  443 [ACK] Seq=4522 Ack=69684 Win=65535 Len=0"
"153","1.141754699","104.109.53.145","10.0.2.15","TLSv1.3","1494","Application Data, Application Data"
"154","1.141755716","10.0.2.15","104.109.53.145","TCP","54","52476  >  443 [ACK] Seq=4522 Ack=71124 Win=65535 Len=0"
"155","1.141785072","104.109.53.145","10.0.2.15","TCP","194","443  >  52476 [PSH, ACK] Seq=71124 Ack=4522 Win=65535 Len=140 [TCP segment of a reassembled PDU]"
"156","1.141786341","10.0.2.15","104.109.53.145","TCP","54","52476  >  443 [ACK] Seq=4522 Ack=71264 Win=65535 Len=0"
"157","1.144078070","104.109.53.145","10.0.2.15","TCP","1514","443  >  52476 [PSH, ACK] Seq=71264 Ack=4522 Win=65535 Len=1460 [TCP segment of a reassembled PDU]"
"158","1.144082893","10.0.2.15","104.109.53.145","TCP","54","52476  >  443 [ACK] Seq=4522 Ack=72724 Win=65535 Len=0"
"159","1.144359176","104.109.53.145","10.0.2.15","TCP","1494","443  >  52476 [ACK] Seq=72724 Ack=4522 Win=65535 Len=1440 [TCP segment of a reassembled PDU]"
"160","1.144361626","10.0.2.15","104.109.53.145","TCP","54","52476  >  443 [ACK] Seq=4522 Ack=74164 Win=65535 Len=0"
"161","1.144484357","104.109.53.145","10.0.2.15","TLSv1.3","2525","Application Data"
"162","1.144488732","10.0.2.15","104.109.53.145","TCP","54","52476  >  443 [ACK] Seq=4522 Ack=76635 Win=65535 Len=0"
"163","1.147785891","10.0.2.15","3.233.158.24","TLSv1.2","318","Application Data"
"164","1.147801893","10.0.2.15","3.233.158.24","TLSv1.2","540","Application Data"
"165","1.147879819","3.233.158.24","10.0.2.15","TCP","60","443  >  53554 [ACK] Seq=1 Ack=265 Win=65535 Len=0"
"166","1.148120073","3.233.158.24","10.0.2.15","TCP","60","443  >  53554 [ACK] Seq=1 Ack=751 Win=65535 Len=0"
"167","1.174809960","10.0.2.15","23.201.191.195","TCP","74","34056  >  443 [SYN] Seq=0 Win=64240 Len=0 MSS=1460 SACK_PERM=1 TSval=3230204613 TSecr=0 WS=128"
"168","1.174842313","10.0.2.15","23.201.191.195","TCP","74","34070  >  443 [SYN] Seq=0 Win=64240 Len=0 MSS=1460 SACK_PERM=1 TSval=3230204613 TSecr=0 WS=128"
"169","1.175992795","10.0.2.15","23.201.191.195","TCP","74","34084  >  443 [SYN] Seq=0 Win=64240 Len=0 MSS=1460 SACK_PERM=1 TSval=3230204614 TSecr=0 WS=128"
"170","1.176031361","10.0.2.15","23.201.191.195","TCP","74","34088  >  443 [SYN] Seq=0 Win=64240 Len=0 MSS=1460 SACK_PERM=1 TSval=3230204614 TSecr=0 WS=128"
"171","1.176223534","10.0.2.15","23.201.191.195","TCP","74","34092  >  443 [SYN] Seq=0 Win=64240 Len=0 MSS=1460 SACK_PERM=1 TSval=3230204614 TSecr=0 WS=128"
"172","1.176258994","10.0.2.15","23.201.191.195","TCP","74","34104  >  443 [SYN] Seq=0 Win=64240 Len=0 MSS=1460 SACK_PERM=1 TSval=3230204614 TSecr=0 WS=128"
"173","1.182697301","23.201.191.195","10.0.2.15","TCP","60","443  >  34070 [SYN, ACK] Seq=0 Ack=1 Win=65535 Len=0 MSS=1460"
"174","1.182713313","10.0.2.15","23.201.191.195","TCP","54","34070  >  443 [ACK] Seq=1 Ack=1 Win=64240 Len=0"
"175","1.183464725","23.201.191.195","10.0.2.15","TCP","60","443  >  34056 [SYN, ACK] Seq=0 Ack=1 Win=65535 Len=0 MSS=1460"
"176","1.183471539","10.0.2.15","23.201.191.195","TCP","54","34056  >  443 [ACK] Seq=1 Ack=1 Win=64240 Len=0"
"177","1.184063067","23.201.191.195","10.0.2.15","TCP","60","443  >  34104 [SYN, ACK] Seq=0 Ack=1 Win=65535 Len=0 MSS=1460"
"178","1.184070668","10.0.2.15","23.201.191.195","TCP","54","34104  >  443 [ACK] Seq=1 Ack=1 Win=64240 Len=0"
"179","1.184813866","23.201.191.195","10.0.2.15","TCP","60","443  >  34084 [SYN, ACK] Seq=0 Ack=1 Win=65535 Len=0 MSS=1460"
"180","1.184816786","10.0.2.15","23.201.191.195","TCP","54","34084  >  443 [ACK] Seq=1 Ack=1 Win=64240 Len=0"
"181","1.185118083","10.0.2.15","23.201.191.195","TLSv1.3","571","Client Hello"
"182","1.185209740","23.201.191.195","10.0.2.15","TCP","60","443  >  34070 [ACK] Seq=1 Ack=518 Win=65535 Len=0"
"183","1.185927919","23.201.191.195","10.0.2.15","TCP","60","443  >  34092 [SYN, ACK] Seq=0 Ack=1 Win=65535 Len=0 MSS=1460"
"184","1.185935685","10.0.2.15","23.201.191.195","TCP","54","34092  >  443 [ACK] Seq=1 Ack=1 Win=64240 Len=0"
"185","1.186027123","23.201.191.195","10.0.2.15","TCP","60","443  >  34088 [SYN, ACK] Seq=0 Ack=1 Win=65535 Len=0 MSS=1460"
"186","1.186029453","10.0.2.15","23.201.191.195","TCP","54","34088  >  443 [ACK] Seq=1 Ack=1 Win=64240 Len=0"
"187","1.187452794","10.0.2.15","23.201.191.195","TLSv1.3","571","Client Hello"
"188","1.187544812","23.201.191.195","10.0.2.15","TCP","60","443  >  34088 [ACK] Seq=1 Ack=518 Win=65535 Len=0"
"189","1.188761202","10.0.2.15","23.201.191.195","TLSv1.3","571","Client Hello"
"190","1.188859596","23.201.191.195","10.0.2.15","TCP","60","443  >  34084 [ACK] Seq=1 Ack=518 Win=65535 Len=0"
"191","1.189769699","10.0.2.15","23.201.191.195","TLSv1.3","571","Client Hello"
"192","1.189863729","23.201.191.195","10.0.2.15","TCP","60","443  >  34056 [ACK] Seq=1 Ack=518 Win=65535 Len=0"
"193","1.190717429","10.0.2.15","23.201.191.195","TLSv1.3","571","Client Hello"
"194","1.190806833","23.201.191.195","10.0.2.15","TCP","60","443  >  34104 [ACK] Seq=1 Ack=518 Win=65535 Len=0"
"195","1.191963493","10.0.2.15","23.201.191.195","TLSv1.3","571","Client Hello"
"196","1.192049057","23.201.191.195","10.0.2.15","TCP","60","443  >  34092 [ACK] Seq=1 Ack=518 Win=65535 Len=0"
"197","1.192376725","10.0.2.15","199.232.90.132","TCP","74","57674  >  443 [SYN] Seq=0 Win=64240 Len=0 MSS=1460 SACK_PERM=1 TSval=4150450153 TSecr=0 WS=128"
"198","1.192427509","10.0.2.15","199.232.90.132","TCP","74","57690  >  443 [SYN] Seq=0 Win=64240 Len=0 MSS=1460 SACK_PERM=1 TSval=4150450153 TSecr=0 WS=128"
"199","1.192770522","10.0.2.15","199.232.90.132","TCP","74","57694  >  443 [SYN] Seq=0 Win=64240 Len=0 MSS=1460 SACK_PERM=1 TSval=4150450153 TSecr=0 WS=128"
"200","1.193040035","10.0.2.15","199.232.90.132","TCP","74","57696  >  443 [SYN] Seq=0 Win=64240 Len=0 MSS=1460 SACK_PERM=1 TSval=4150450153 TSecr=0 WS=128"
"201","1.193709688","10.0.2.15","199.232.90.132","TCP","74","57700  >  443 [SYN] Seq=0 Win=64240 Len=0 MSS=1460 SACK_PERM=1 TSval=4150450154 TSecr=0 WS=128"
"202","1.194068156","10.0.2.15","199.232.90.132","TCP","74","57704  >  443 [SYN] Seq=0 Win=64240 Len=0 MSS=1460 SACK_PERM=1 TSval=4150450154 TSecr=0 WS=128"
"203","1.202102485","10.0.2.15","108.138.112.90","TCP","74","55262  >  443 [SYN] Seq=0 Win=64240 Len=0 MSS=1460 SACK_PERM=1 TSval=2601449765 TSecr=0 WS=128"
"204","1.202787954","3.233.158.24","10.0.2.15","TLSv1.2","213","Application Data"
"205","1.202793292","10.0.2.15","3.233.158.24","TCP","54","53554  >  443 [ACK] Seq=751 Ack=160 Win=63360 Len=0"
"206","1.204772063","23.201.191.195","10.0.2.15","TLSv1.3","2934","Server Hello, Change Cipher Spec, Application Data"
"207","1.204777368","10.0.2.15","23.201.191.195","TCP","54","34088  >  443 [ACK] Seq=518 Ack=2881 Win=63360 Len=0"
"208","1.204822507","23.201.191.195","10.0.2.15","TCP","94","443  >  34088 [PSH, ACK] Seq=2881 Ack=518 Win=65535 Len=40 [TCP segment of a reassembled PDU]"
"209","1.204825154","10.0.2.15","23.201.191.195","TCP","54","34088  >  443 [ACK] Seq=518 Ack=2921 Win=63320 Len=0"
"210","1.205055292","23.201.191.195","10.0.2.15","TLSv1.3","1210","Application Data, Application Data, Application Data"
"211","1.205057457","10.0.2.15","23.201.191.195","TCP","54","34088  >  443 [ACK] Seq=518 Ack=4077 Win=62164 Len=0"
"212","1.206304024","23.201.191.195","10.0.2.15","TLSv1.3","1494","Server Hello, Change Cipher Spec, Application Data"
"213","1.206308497","10.0.2.15","23.201.191.195","TCP","54","34056  >  443 [ACK] Seq=518 Ack=1441 Win=63360 Len=0"
"214","1.206356984","23.201.191.195","10.0.2.15","TCP","74","443  >  34056 [PSH, ACK] Seq=1441 Ack=518 Win=65535 Len=20 [TCP segment of a reassembled PDU]"
"215","1.206358548","10.0.2.15","23.201.191.195","TCP","54","34056  >  443 [ACK] Seq=518 Ack=1461 Win=63360 Len=0"
"216","1.206874900","23.201.191.195","10.0.2.15","TCP","1494","443  >  34056 [ACK] Seq=1461 Ack=518 Win=65535 Len=1440 [TCP segment of a reassembled PDU]"
"217","1.206878477","10.0.2.15","23.201.191.195","TCP","54","34056  >  443 [ACK] Seq=518 Ack=2901 Win=63360 Len=0"
"218","1.206929183","23.201.191.195","10.0.2.15","TCP","74","443  >  34056 [PSH, ACK] Seq=2901 Ack=518 Win=65535 Len=20 [TCP segment of a reassembled PDU]"
"219","1.206932596","10.0.2.15","23.201.191.195","TCP","54","34056  >  443 [ACK] Seq=518 Ack=2921 Win=63340 Len=0"
"220","1.207392575","23.201.191.195","10.0.2.15","TLSv1.3","1210","Application Data, Application Data, Application Data"
"221","1.207395638","10.0.2.15","23.201.191.195","TCP","54","34056  >  443 [ACK] Seq=518 Ack=4077 Win=62184 Len=0"
"222","1.208557384","23.201.191.195","10.0.2.15","TLSv1.3","1494","Server Hello, Change Cipher Spec, Application Data"
"223","1.208576120","10.0.2.15","23.201.191.195","TCP","54","34104  >  443 [ACK] Seq=518 Ack=1441 Win=63360 Len=0"
"224","1.208613395","23.201.191.195","10.0.2.15","TCP","74","443  >  34104 [PSH, ACK] Seq=1441 Ack=518 Win=65535 Len=20 [TCP segment of a reassembled PDU]"
"225","1.208614751","10.0.2.15","23.201.191.195","TCP","54","34104  >  443 [ACK] Seq=518 Ack=1461 Win=63360 Len=0"
"226","1.208947013","23.201.191.195","10.0.2.15","TCP","1514","443  >  34104 [PSH, ACK] Seq=1461 Ack=518 Win=65535 Len=1460 [TCP segment of a reassembled PDU]"
"227","1.208951760","10.0.2.15","23.201.191.195","TCP","54","34104  >  443 [ACK] Seq=518 Ack=2921 Win=61920 Len=0"
"228","1.209468878","23.201.191.195","10.0.2.15","TLSv1.3","1211","Application Data, Application Data, Application Data"
"229","1.209470496","10.0.2.15","23.201.191.195","TCP","54","34104  >  443 [ACK] Seq=518 Ack=4078 Win=60763 Len=0"
"230","1.209702504","199.232.90.132","10.0.2.15","TCP","60","443  >  57694 [SYN, ACK] Seq=0 Ack=1 Win=65535 Len=0 MSS=1460"
"231","1.209708564","10.0.2.15","199.232.90.132","TCP","54","57694  >  443 [ACK] Seq=1 Ack=1 Win=64240 Len=0"
"232","1.209739364","199.232.90.132","10.0.2.15","TCP","60","443  >  57674 [SYN, ACK] Seq=0 Ack=1 Win=65535 Len=0 MSS=1460"
"233","1.209740983","10.0.2.15","199.232.90.132","TCP","54","57674  >  443 [ACK] Seq=1 Ack=1 Win=64240 Len=0"
"234","1.209834762","199.232.90.132","10.0.2.15","TCP","60","443  >  57704 [SYN, ACK] Seq=0 Ack=1 Win=65535 Len=0 MSS=1460"
"235","1.209837015","10.0.2.15","199.232.90.132","TCP","54","57704  >  443 [ACK] Seq=1 Ack=1 Win=64240 Len=0"
"236","1.209870560","199.232.90.132","10.0.2.15","TCP","60","443  >  57700 [SYN, ACK] Seq=0 Ack=1 Win=65535 Len=0 MSS=1460"
"237","1.209872070","10.0.2.15","199.232.90.132","TCP","54","57700  >  443 [ACK] Seq=1 Ack=1 Win=64240 Len=0"
"238","1.209971077","199.232.90.132","10.0.2.15","TCP","60","443  >  57690 [SYN, ACK] Seq=0 Ack=1 Win=65535 Len=0 MSS=1460"
"239","1.209972739","10.0.2.15","199.232.90.132","TCP","54","57690  >  443 [ACK] Seq=1 Ack=1 Win=64240 Len=0"
"240","1.210814512","199.232.90.132","10.0.2.15","TCP","60","443  >  57696 [SYN, ACK] Seq=0 Ack=1 Win=65535 Len=0 MSS=1460"
"241","1.210822540","10.0.2.15","199.232.90.132","TCP","54","57696  >  443 [ACK] Seq=1 Ack=1 Win=64240 Len=0"
"242","1.212427230","23.201.191.195","10.0.2.15","TLSv1.3","2934","Server Hello, Change Cipher Spec, Application Data"
"243","1.212432294","10.0.2.15","23.201.191.195","TCP","54","34092  >  443 [ACK] Seq=518 Ack=2881 Win=63360 Len=0"
"244","1.212526248","23.201.191.195","10.0.2.15","TCP","94","443  >  34092 [PSH, ACK] Seq=2881 Ack=518 Win=65535 Len=40 [TCP segment of a reassembled PDU]"
"245","1.212528895","10.0.2.15","23.201.191.195","TCP","54","34092  >  443 [ACK] Seq=518 Ack=2921 Win=63320 Len=0"
"246","1.212612797","10.0.2.15","199.232.90.132","TLSv1.3","571","Client Hello"
"247","1.212655896","23.201.191.195","10.0.2.15","TLSv1.3","1210","Application Data, Application Data, Application Data"
"248","1.212660972","10.0.2.15","23.201.191.195","TCP","54","34092  >  443 [ACK] Seq=518 Ack=4077 Win=62164 Len=0"
"249","1.212709305","199.232.90.132","10.0.2.15","TCP","60","443  >  57674 [ACK] Seq=1 Ack=518 Win=65535 Len=0"
"250","1.212938649","108.138.112.90","10.0.2.15","TCP","60","443  >  55262 [SYN, ACK] Seq=0 Ack=1 Win=65535 Len=0 MSS=1460"
"251","1.212964934","10.0.2.15","108.138.112.90","TCP","54","55262  >  443 [ACK] Seq=1 Ack=1 Win=64240 Len=0"
"252","1.214716717","10.0.2.15","199.232.90.132","TLSv1.3","571","Client Hello"
"253","1.214887211","199.232.90.132","10.0.2.15","TCP","60","443  >  57694 [ACK] Seq=1 Ack=518 Win=65535 Len=0"
"254","1.217074486","10.0.2.15","199.232.90.132","TLSv1.3","571","Client Hello"
"255","1.217182790","199.232.90.132","10.0.2.15","TCP","60","443  >  57690 [ACK] Seq=1 Ack=518 Win=65535 Len=0"
"256","1.217911331","10.0.2.15","199.232.90.132","TLSv1.3","571","Client Hello"
"257","1.217990059","199.232.90.132","10.0.2.15","TCP","60","443  >  57696 [ACK] Seq=1 Ack=518 Win=65535 Len=0"
"258","1.218789093","10.0.2.15","199.232.90.132","TLSv1.3","571","Client Hello"
"259","1.218880821","199.232.90.132","10.0.2.15","TCP","60","443  >  57700 [ACK] Seq=1 Ack=518 Win=65535 Len=0"
"260","1.219677804","10.0.2.15","199.232.90.132","TLSv1.3","571","Client Hello"
"261","1.219759190","199.232.90.132","10.0.2.15","TCP","60","443  >  57704 [ACK] Seq=1 Ack=518 Win=65535 Len=0"
"262","1.222381763","10.0.2.15","108.138.112.90","TLSv1.3","571","Client Hello"
"263","1.222465508","108.138.112.90","10.0.2.15","TCP","60","443  >  55262 [ACK] Seq=1 Ack=518 Win=65535 Len=0"
"264","1.223237224","10.0.2.15","142.250.64.106","TCP","74","40882  >  443 [SYN] Seq=0 Win=64240 Len=0 MSS=1460 SACK_PERM=1 TSval=2858594306 TSecr=0 WS=128"
"265","1.223833551","10.0.2.15","23.201.191.195","TLSv1.3","134","Change Cipher Spec, Application Data"
"266","1.226305188","10.0.2.15","23.201.191.195","TLSv1.3","224","Application Data"
"267","1.226337946","10.0.2.15","23.201.191.195","TCP","2974","34088  >  443 [PSH, ACK] Seq=768 Ack=4077 Win=63360 Len=2920 [TCP segment of a reassembled PDU]"
"268","1.226384422","23.201.191.195","10.0.2.15","TCP","60","443  >  34088 [ACK] Seq=4077 Ack=598 Win=65535 Len=0"
"269","1.226391138","10.0.2.15","23.201.191.195","TLSv1.3","397","Application Data"
"270","1.226429660","23.201.191.195","10.0.2.15","TCP","60","443  >  34088 [ACK] Seq=4077 Ack=768 Win=65535 Len=0"
"271","1.226429715","23.201.191.195","10.0.2.15","TCP","60","443  >  34088 [ACK] Seq=4077 Ack=2228 Win=65535 Len=0"
"272","1.226471266","23.201.191.195","10.0.2.15","TCP","60","443  >  34088 [ACK] Seq=4077 Ack=3688 Win=65535 Len=0"
"273","1.226471299","23.201.191.195","10.0.2.15","TCP","60","443  >  34088 [ACK] Seq=4077 Ack=4031 Win=65535 Len=0"
"274","1.227837072","10.0.2.15","23.201.191.195","TLSv1.3","3344","Application Data"
"275","1.227930321","23.201.191.195","10.0.2.15","TCP","60","443  >  34088 [ACK] Seq=4077 Ack=5491 Win=65535 Len=0"
"276","1.227957479","23.201.191.195","10.0.2.15","TCP","60","443  >  34088 [ACK] Seq=4077 Ack=6951 Win=65535 Len=0"
"277","1.227957523","23.201.191.195","10.0.2.15","TCP","60","443  >  34088 [ACK] Seq=4077 Ack=7321 Win=65535 Len=0"
"278","1.228004702","10.0.2.15","23.201.191.195","TLSv1.3","134","Change Cipher Spec, Application Data"
"279","1.228150882","10.0.2.15","23.201.191.195","TLSv1.3","134","Change Cipher Spec, Application Data"
"280","1.228359900","10.0.2.15","23.201.191.195","TLSv1.3","241","Application Data"
"281","1.228368836","10.0.2.15","23.201.191.195","TLSv1.3","241","Application Data"
"282","1.228429375","23.201.191.195","10.0.2.15","TCP","60","443  >  34056 [ACK] Seq=4077 Ack=785 Win=65535 Len=0"
"283","1.228464977","23.201.191.195","10.0.2.15","TCP","60","443  >  34104 [ACK] Seq=4078 Ack=785 Win=65535 Len=0"
"284","1.229816008","10.0.2.15","23.201.191.195","TLSv1.3","3307","Application Data"
"285","1.229901010","23.201.191.195","10.0.2.15","TCP","60","443  >  34088 [ACK] Seq=4077 Ack=8781 Win=65535 Len=0"
"286","1.229920041","23.201.191.195","10.0.2.15","TCP","60","443  >  34088 [ACK] Seq=4077 Ack=10241 Win=65535 Len=0"
"287","1.229957852","23.201.191.195","10.0.2.15","TCP","60","443  >  34088 [ACK] Seq=4077 Ack=10574 Win=65535 Len=0"
"288","1.229973280","10.0.2.15","23.201.191.195","TLSv1.3","3288","Application Data"
"289","1.230026300","23.201.191.195","10.0.2.15","TCP","60","443  >  34088 [ACK] Seq=4077 Ack=12034 Win=65535 Len=0"
"290","1.230053852","23.201.191.195","10.0.2.15","TCP","60","443  >  34088 [ACK] Seq=4077 Ack=13494 Win=65535 Len=0"
"291","1.230091542","23.201.191.195","10.0.2.15","TCP","60","443  >  34088 [ACK] Seq=4077 Ack=13808 Win=65535 Len=0"
"292","1.230510457","10.0.2.15","23.201.191.195","TLSv1.3","134","Change Cipher Spec, Application Data"
"293","1.230700749","10.0.2.15","23.201.191.195","TLSv1.3","241","Application Data"
"294","1.230788757","23.201.191.195","10.0.2.15","TCP","60","443  >  34092 [ACK] Seq=4077 Ack=785 Win=65535 Len=0"
"295","1.231577597","10.0.2.15","23.201.191.195","TLSv1.3","3333","Application Data"
"296","1.231666767","23.201.191.195","10.0.2.15","TCP","60","443  >  34088 [ACK] Seq=4077 Ack=15268 Win=65535 Len=0"
"297","1.231701483","23.201.191.195","10.0.2.15","TCP","60","443  >  34088 [ACK] Seq=4077 Ack=16728 Win=65535 Len=0"
"298","1.231742509","23.201.191.195","10.0.2.15","TCP","60","443  >  34088 [ACK] Seq=4077 Ack=17087 Win=65535 Len=0"
"299","1.233265024","199.232.90.132","10.0.2.15","TLSv1.3","1446","Server Hello, Change Cipher Spec, Application Data"
"300","1.233270012","10.0.2.15","199.232.90.132","TCP","54","57674  >  443 [ACK] Seq=518 Ack=1393 Win=64032 Len=0"
"301","1.236851627","199.232.90.132","10.0.2.15","TCP","1446","443  >  57674 [PSH, ACK] Seq=1393 Ack=518 Win=65535 Len=1392 [TCP segment of a reassembled PDU]"
"302","1.236856483","10.0.2.15","199.232.90.132","TCP","54","57674  >  443 [ACK] Seq=518 Ack=2785 Win=64032 Len=0"
"303","1.237413928","199.232.90.132","10.0.2.15","TLSv1.3","1155","Application Data, Application Data, Application Data, Application Data"
"304","1.237418675","10.0.2.15","199.232.90.132","TCP","54","57674  >  443 [ACK] Seq=518 Ack=3886 Win=64032 Len=0"
"305","1.239785501","199.232.90.132","10.0.2.15","TLSv1.3","2934","Server Hello, Change Cipher Spec, Application Data"
"306","1.239790893","10.0.2.15","199.232.90.132","TCP","54","57694  >  443 [ACK] Seq=518 Ack=2881 Win=63360 Len=0"
"307","1.239890633","199.232.90.132","10.0.2.15","TLSv1.3","1059","Application Data, Application Data, Application Data, Application Data"
"308","1.239893630","10.0.2.15","199.232.90.132","TCP","54","57694  >  443 [ACK] Seq=518 Ack=3886 Win=62355 Len=0"
"309","1.240379302","199.232.90.132","10.0.2.15","TLSv1.3","1494","Server Hello, Change Cipher Spec, Application Data"
"310","1.240381829","10.0.2.15","199.232.90.132","TCP","54","57690  >  443 [ACK] Seq=518 Ack=1441 Win=63360 Len=0"
"311","1.240439065","199.232.90.132","10.0.2.15","TCP","1398","443  >  57690 [PSH, ACK] Seq=1441 Ack=518 Win=65535 Len=1344 [TCP segment of a reassembled PDU]"
"312","1.240440804","10.0.2.15","199.232.90.132","TCP","54","57690  >  443 [ACK] Seq=518 Ack=2785 Win=63360 Len=0"
"313","1.240690673","199.232.90.132","10.0.2.15","TLSv1.3","1155","Application Data, Application Data, Application Data, Application Data"
"314","1.240691931","10.0.2.15","199.232.90.132","TCP","54","57690  >  443 [ACK] Seq=518 Ack=3886 Win=63360 Len=0"
"315","1.242181806","199.232.90.132","10.0.2.15","TLSv1.3","2838","Server Hello, Change Cipher Spec, Application Data"
"316","1.242186968","10.0.2.15","199.232.90.132","TCP","54","57696  >  443 [ACK] Seq=518 Ack=2785 Win=63360 Len=0"
"317","1.242538478","199.232.90.132","10.0.2.15","TLSv1.3","1155","Application Data, Application Data, Application Data, Application Data"
"318","1.242544461","10.0.2.15","199.232.90.132","TCP","54","57696  >  443 [ACK] Seq=518 Ack=3886 Win=62259 Len=0"
"319","1.243351254","10.0.2.15","199.232.90.132","TLSv1.3","118","Change Cipher Spec, Application Data"
"320","1.243434880","199.232.90.132","10.0.2.15","TCP","60","443  >  57674 [ACK] Seq=3886 Ack=582 Win=65535 Len=0"
"321","1.243642596","199.232.90.132","10.0.2.15","TLSv1.3","1446","Server Hello, Change Cipher Spec, Application Data"
"322","1.243645866","10.0.2.15","199.232.90.132","TCP","54","57700  >  443 [ACK] Seq=518 Ack=1393 Win=64032 Len=0"
"323","1.243994742","199.232.90.132","10.0.2.15","TCP","1446","443  >  57700 [PSH, ACK] Seq=1393 Ack=518 Win=65535 Len=1392 [TCP segment of a reassembled PDU]"
"324","1.244000071","10.0.2.15","199.232.90.132","TCP","54","57700  >  443 [ACK] Seq=518 Ack=2785 Win=62640 Len=0"
"325","1.244132074","199.232.90.132","10.0.2.15","TLSv1.3","1155","Application Data, Application Data, Application Data, Application Data"
"326","1.244135170","10.0.2.15","199.232.90.132","TCP","54","57700  >  443 [ACK] Seq=518 Ack=3886 Win=64032 Len=0"
"327","1.244382064","142.250.64.106","10.0.2.15","TCP","60","443  >  40882 [SYN, ACK] Seq=0 Ack=1 Win=65535 Len=0 MSS=1460"
"328","1.244391011","10.0.2.15","142.250.64.106","TCP","54","40882  >  443 [ACK] Seq=1 Ack=1 Win=64240 Len=0"
"329","1.245003254","10.0.2.15","199.232.90.132","TLSv1.3","224","Application Data"
"330","1.245111264","199.232.90.132","10.0.2.15","TCP","60","443  >  57674 [ACK] Seq=3886 Ack=752 Win=65535 Len=0"
"331","1.245347073","108.138.112.90","10.0.2.15","TLSv1.3","1494","Server Hello, Change Cipher Spec, Application Data"
"332","1.245352072","10.0.2.15","108.138.112.90","TCP","54","55262  >  443 [ACK] Seq=518 Ack=1441 Win=63360 Len=0"
"333","1.245427184","10.0.2.15","199.232.90.132","TCP","2974","57674  >  443 [PSH, ACK] Seq=752 Ack=3886 Win=64032 Len=2920 [TCP segment of a reassembled PDU]"
"334","1.245489579","10.0.2.15","199.232.90.132","TLSv1.3","423","Application Data"
"335","1.245520641","199.232.90.132","10.0.2.15","TCP","60","443  >  57674 [ACK] Seq=3886 Ack=2212 Win=65535 Len=0"
"336","1.245560520","199.232.90.132","10.0.2.15","TCP","60","443  >  57674 [ACK] Seq=3886 Ack=3672 Win=65535 Len=0"
"337","1.245591134","199.232.90.132","10.0.2.15","TCP","60","443  >  57674 [ACK] Seq=3886 Ack=4041 Win=65535 Len=0"
"338","1.245647915","10.0.2.15","199.232.90.132","TCP","2974","57674  >  443 [PSH, ACK] Seq=4041 Ack=3886 Win=64032 Len=2920 [TCP segment of a reassembled PDU]"
"339","1.245706307","10.0.2.15","199.232.90.132","TLSv1.3","425","Application Data"
